hypothesis_id,hypothesis_name,mechanism_family,police_relevance,fire_relevance,non_safety_relevance_or_counterpoint,expected_textual_signals,likely_source_types,possible_quant_data,confounds,proposed_gabriel_attribute,priority
H1,labor scarcity and recruitment pressure,labor_market,high,medium_high,"Many non-safety units also face hiring strain; must compare intensity and qualification bottlenecks; VERIFIED 2026-07-05 via national scan (see national_municipal_workforce_mechanism_scan_2026-07-05.md): MissionSquare/SLGE's 2024 State and Local Government Workforce Survey rates policing 68% hard-to-fill nationally -- real, but not the single hardest local-government occupation, since mental health professionals (83%), nursing (77%), and corrections/jails (74%) all rank higher in the same survey; do not frame police staffing pressure as uniquely severe relative to other local-government occupations without this comparison","vacancies; hard to recruit; applicant shortage; retention bonus; signing bonus; cannot fill academy; lateral competition","BLS; PERF; city HR reports; budgets; news","applicants per opening; vacancy duration; hires; separations; academy fill rates","processing delays; standards changes; fiscal hiring freezes","recruitment_retention_pressure",high
H2,post-2020 policing climate shock,political_legitimacy,high,low,"Not a general municipal explanation and should not be overgeneralized from police to fire or non-safety; distinct from COVID-era hiring disruption, pension-vintage retirement timing, and the broad 2021-2023 Great Resignation, which are separate channels needing separate evidence and would also show up in non-safety municipal hiring","morale; scrutiny; public criticism; George Floyd; protests; resignations; retirements; unsupported by city leaders -- text must name the specific channel (legitimacy/scrutiny vs. COVID hiring disruption vs. retirement-eligibility timing vs. general labor-market competition) rather than being scored from any post-2020 staffing mention","PERF; news; union statements; city staffing reports","applications over time; retirements; resignations; survey responses; compare police quit-rate change to overall municipal/private-sector quit-rate change over the same window","COVID labor disruption; crime trends; agency competition; pension-vintage retirement bulges unrelated to any 2020 shock","post_2020_policing_climate",high
H3,compensating differentials for risk stress and hours,working_conditions,high,high,"Transit, sanitation, nursing, corrections, and public works emergencies may also carry high burden","dangerous; stressful; injury; trauma; shift work; 24/7; mandatory overtime; on call","BLS; NIOSH; local reports; arbitration awards","injury rates; OT hours; disability retirements; schedule premiums","occupational culture may exaggerate or understate burden in text","hazard_or_working_conditions",high
H4,overtime staffing spiral,staffing_dynamics,high,high,"Other coverage-constrained services may also spiral when vacancies rise; DPW emergency response (esp. snow/storm) is a close analog but differs structurally -- routine, pre-arranged private-contractor substitution and seasonally-predictable surge staffing are available to DPW in a way they are not to police/fire, so DPW emergency staffing strain more plausibly converts into overtime and contractor spending than into a police/fire-style recurring overtime spiral (see dpw_overtime_emergency_response discussion in non_safety_dpw_public_works_wage_mechanism_refinement_2026-07-04.md)","mandatory overtime; callback; minimum staffing; backfill; exhausted workforce; burnout; for DPW specifically: storm response; snow removal; contractor retainer; chronic overtime on the same routes (a planning-problem signal per municipal risk-management guidance, distinct from legitimate large-event overtime)","contracts; payroll reports; budgets; news; DPW winter-operations plans and contractor/procurement records for non-safety comparison","overtime spending; hours; vacancies; sick leave; resignation hazards; DPW contractor spending during emergencies as a comparison outcome (reported at roughly 3x normal rates during active events)","overtime may be effect rather than cause; DPW contractor substitution option is not available to police/fire, so the two are not a clean apples-to-apples comparison","overtime_staffing_pressure",high
H5,comparator ratchet,comparability,high,medium_high,"Teacher and other public bargaining may also use peers; not public-safety-specific by default; Massachusetts teacher bargaining commonly invokes 'surrounding' or 'comparable' district salary comparisons, but without an interest-arbitration backstop to enforce the comparison the way JLMC can for police/fire, the comparator claim may function more as aspirational or budget-override-campaign rhetoric than as a binding standard (see teacher_peer_district_comparability discussion in non_safety_teacher_wage_mechanism_refinement_2026-07-04.md); CONFIRMED 2026-07-04 (see ma_teacher_bargaining_school_finance_institutional_context_2026-07-04.md): JLMC comparator criteria are statutorily mandated for arbitrators to weigh, while teacher-side comparator claims have no equivalent compulsory enforcement mechanism","comparable communities; parity; surrounding cities; peer departments; wage survey","awards; bargaining packets; meeting materials; some CBAs","peer wage trends; matched text scores; downstream wage changes","document-type confounding; rhetoric versus causation","comparability_emphasis",high
H6,arbitration or impasse backstop,institutions,high,high,"Some non-safety sectors also use mediation/factfinding, so bare backstop presence is not unique; VERIFIED 2026-07-04 for Massachusetts (see ma_teacher_bargaining_school_finance_institutional_context_2026-07-04.md): the sharper, confirmed comparison is that JLMC orders police/fire into compulsory binding interest arbitration upon certified impasse, while teachers and most other MA public employees under M.G.L. c. 150E Section 9 have only mediation plus advisory (non-binding) factfinding, after which the employer may unilaterally implement its last, best offer; a voluntary arbitration route exists on paper for non-police/fire units but requires mutual agreement plus employer/school-committee authorization and is not typical in practice (Mass.gov's own guidance describes non-police/fire bargaining as having 'no arbitration process') -- this is a compulsory-vs-voluntary institutional-design difference, not a has-backstop-vs-has-no-process-at-all difference; VERIFIED 2026-07-04 for MA public works/DPW too (see ma_dpw_bargaining_impasse_context_2026-07-04.md): JLMC eligibility is confirmed police/fire-specific with no public-works extension, and this project's own public_works corpus corroborates it directly -- every public_works row's binding_arbitration_statute field cites MA G.L. c. 150E (never the JLMC statute used by every police/fire row), and every arbitration clause found in that corpus is grievance/discipline-scoped, not interest-arbitration-scoped (Seekonk's contract states this explicitly: 'Final binding arbitration will prevail on grievances only'); VERIFIED 2026-07-05 for MA clerical/admin too (see ma_clerical_admin_bargaining_impasse_context_2026-07-05.md): the Massachusetts Municipal Association's own Select Board Handbook explicitly names 'clerical and administrative employees' as ineligible for JLMC services (the most direct confirmation yet, naming the occupation class explicitly rather than requiring inference from a general non-police/fire rule); this project's own Boston clerical/admin corpus shows an even narrower dispute-resolution scope than DPW's grievance arbitration -- a Compensation Grade Appeals process limiting any arbitrator to an 'arbitrary or capricious' review standard, not a full merits review, with no retroactive remedy; a further wrinkle unique to clerical/admin is that some administrative positions closest to municipal executive leadership are 'confidential employees' excluded from collective bargaining entirely, meaning their pay is set unilaterally rather than through any impasse process at all; VERIFIED 2026-07-05 via national scan (see national_municipal_workforce_mechanism_scan_2026-07-05.md): the underlying policy pattern (compulsory police/fire arbitration paired with a strike prohibition) is NOT unique to Massachusetts -- comparable statutes exist in at least NJ, NY, MI, RI, PA, WY, and OK -- so JLMC is Massachusetts's implementation of a recurring multi-state pattern, not a one-off; conversely, the 'non-safety lacks compulsory arbitration' side does not generalize cleanly either -- Iowa is a documented exception allowing state-labor-board-ordered binding arbitration for teachers, and the entire premise assumes bargaining rights exist, which is false for public-sector employees generally in NC and SC and was false in VA before a 2020 reform; CITATION-AUDITED 2026-07-05 (see public_sector_impasse_arbitration_state_law_citation_audit_2026-07-05.md and its companion CSV table): every state claim above now has a primary statutory citation and confidence rating -- NJ (N.J.S.A. 34:13A-14 to -21), NY (Civil Service Law Section 209.4), MI (Act 312 of 1969), RI (Gen. Laws Ch.28-9.1/28-9.2/28-9.5), PA (Act 111 of 1968), OK (Title 11 Section 51-101), NC (G.S. 95-98), and VA (Va. Code Section 40.1-57.2) are primary-source-confirmed; WY's statute (W.S. 27-10-101 to -109) is CORRECTED to fire-only, no police equivalent found; Iowa's exception (Iowa Code Section 20.22) is confirmed as a GENERAL all-public-employee mechanism, not teacher-specific, and Iowa's 2017 reform added its own safety-favoring asymmetry via bargaining scope/arbitration-criteria restriction for non-safety units rather than via arbitration availability; SC's prohibition remains secondary-source-only, needing follow-up; Illinois (5 ILCS 315/14) added as a further confirmed multi-state example","interest arbitration; impasse; factfinding; JLMC; stipulated award; mediation; explicit no-strike prohibition paired with the impasse process; union and employer final positions plus awarded figure (for later bunching/centering analysis, not for collection-time classification); for non-safety MA units, look for 'advisory' or 'recommendations' language describing factfinding, or 'last best offer' unilateral-implementation language, as the textual signature of the weaker process","awards; JLMC materials; legal sources; bargaining summaries; MA DLR impasse/factfinding materials for non-safety comparison","award incidence; settlement timing; wage outcomes with/without backstop; award-to-offer-gap ratio for splitting vs. criteria-applying test; conventional vs. final-offer-arbitration jurisdictions as a comparison; frequency of unilateral last-best-offer implementation in non-safety MA bargaining as the analog outcome measure","visibility in documents may exceed causal importance; MA/JLMC is one institutional case, not the national arbitration story","arbitration_or_impasse_backstop",high
H7,political salience and public safety premium,politics,high,high,"Schools, transit, sanitation, snow removal, and public health can also be highly salient; DPW specifically likely has lower baseline political salience than police/fire because DPW failures (a pothole, a slightly late plow pass) are diffuse and cumulative rather than single dramatic incidents, though acute DPW failures (prolonged water outages, major sinkholes, badly delayed storm response) can generate comparable salience (see dpw_lower_public_salience discussion in non_safety_dpw_public_works_wage_mechanism_refinement_2026-07-04.md); CITATION-AUDITED 2026-07-05 (see public_sector_impasse_arbitration_state_law_citation_audit_2026-07-05.md): the police/fire institutional-privilege premise is not treated as self-evidently constitutional everywhere -- Wisconsin's 2011 Act 10 exempted police/fire/state troopers from general public-employee bargaining restrictions, but a December 2024 Dane County ruling struck down that exemption as an equal-protection violation under the Wisconsin Constitution (secondary-source-only, status unsettled/likely under appeal); this is a caution against treating public-safety institutional privilege as an uncontested design choice, not a claim that Massachusetts's own JLMC arrangement faces a comparable legal challenge","public safety; cannot leave positions unfilled; residents demand coverage; elected pressure; for DPW: public health, infrastructure reliability, or essential-services framing co-occurring with a specific service-failure event, as distinct from generic budget narrative","budgets; council minutes; news; arbitration findings","budget reallocations; emergency appropriations; staffing mandates; local news coverage volume for a DPW service failure vs. a comparable-severity police/fire incident, as a salience proxy","salience is hard to measure and may vary by event","political_support_or_public_salience",medium_high
H8,union power or institutional privilege,labor_institutions,high,high,"Could overlap with arbitration rules and legal strike constraints rather than independent power","protected bargaining status; statutory process; leverage; no-strike substitution","state statutes; arbitration scholarship; awards; labor law references","contract cycle length; impasse frequency; settlement patterns","difficult to separate from fiscal capacity and labor scarcity","union_power_or_institutional_leverage",medium_high
H9,budget capacity and property tax base,fiscal_capacity,medium,medium,"General explanation for many municipal wages, not just safety; VERIFIED 2026-07-04 for Massachusetts school finance (see ma_teacher_bargaining_school_finance_institutional_context_2026-07-04.md): schools face a two-sided constraint most other municipal departments (including police/fire) do not -- a state-mandated spending floor (net school spending = Chapter 70 aid plus required local contribution, per DESE's foundation-budget formula, with no municipality required to fund more than 82.5% of its foundation budget locally) plus the same municipal Proposition 2 1/2 levy-limit ceiling shared by all departments; the floor is school-specific, the ceiling is general, and override votes are the mechanism for raising the ceiling; VERIFIED 2026-07-05 via national scan (see national_municipal_workforce_mechanism_scan_2026-07-05.md): the general foundation-formula architecture (a state-set minimum spending floor filled by state aid after a local-capacity-based required contribution) is the dominant national school-finance model, not a Massachusetts invention -- comparable structures are confirmed in NJ ('Adequacy Budget - Local Share = Equalization Aid') and WI; Chapter 70's specific 82.5% cap and exact net-school-spending definition remain Massachusetts-specific parameters within that general architecture, and should not be assumed to transfer numerically to another state","ability to pay; tax base; budget reserves; levy limit; revenue growth; override; state aid; net school spending; foundation budget; required local contribution","budgets; CAFRs; census; awards; DESE Chapter 70 program pages and district net-school-spending reports","assessed value; tax base; own-source revenue; debt; district-level net school spending vs. foundation budget compliance over time","capacity may raise all wages and service spending; the state-aid floor could mask or offset local fiscal-capacity variation in ways ordinary municipal ability-to-pay measures do not capture","fiscal_capacity_ability_to_pay",medium_high
H10,credentialing and training barriers,training_credentials,medium,high,"Many municipal jobs also require licensing or CDL-style credentials","academy; EMT; certification; continuing education; physical test; background check","BLS; NVFC; academy standards; local hiring materials","pass rates; training duration; credential maintenance cost","requirements may proxy quality standards more than scarcity","training_credentialing_burden",medium_high
H11,volunteer to career transition pressure,fire_structure,low,high,"Mostly fire-specific; non-safety comparison comes through service model rather than direct wage setting; transmission is lagged and indirect through three distinct channels -- (1) combination-department conversion/new paid-on-call stipend lines, (2) overtime/minimum-staffing substitution in existing career units, (3) full volunteer-to-career professionalization creating a brand-new bargaining unit -- rather than direct growth in an existing career CBA's base wage; VERIFIED 2026-07-05 via national scan (see national_municipal_workforce_mechanism_scan_2026-07-05.md): NFPA data quantifies the national volunteer decline directly -- 897,750 volunteer firefighters in 1984 to 676,900 in 2020 (a 25% decline while US population grew ~40%), with IAFF reporting communities converting to all-career departments as the documented adaptation; this is now a national, quantified trend, not only a qualitative framing","volunteer shortage; paid on call; combination department; daytime response gap -- text should specify which of the three transmission channels is being described so it is coded as volunteer-pipeline evidence vs. career wage-setting evidence per the two-corpus discipline","NVFC; NFPA/FPRF; local fire studies; news","volunteer headcount; turnout; paid staffing growth; stipend adoption; sequence of volunteer-decline evidence relative to new paid/combination staffing lines or new bargaining units","may affect budgets or staffing mix more than base wages; effect may show up years before (or instead of) negotiated base-wage change","public_safety_service_necessity",medium
H12,risk liability and legal exposure,exposure_liability,high,medium_high,"Other municipal jobs can also face liability, especially corrections, nursing, transit, and utilities","liability; lawsuit risk; line-of-duty injury; PTSD; disability retirement","budgets; claims reports; NIOSH; awards","workers comp; disability pensions; claims costs; leave usage","may overlap with hazard/stress rather than separate channel","hazard_or_working_conditions",medium
H13,teacher supply and recruitment pressure,labor_market,low,low,"Teachers are public-facing, credentialed, unionized, and generally well-regarded, yet NCES School Pulse Panel data show 74% of public schools had difficulty filling at least one teaching vacancy entering 2024-25 (down from 79%), with lack of qualified candidates (64%) and too few applicants (62%) as the top two challenges, and special education/bilingual-ESL vacancies hardest to fill by grade band; public esteem for teachers should not be read as evidence of abundant supply at the credentialed, subject-qualified margin, the same caution already applied to firefighters","teacher shortage; vacancy; long-term substitute; emergency certification; provisional license; under-certified; hard-to-fill; lack of qualified candidates; too few applicants","NCES/IES School Pulse Panel; Learning Policy Institute; state education agency staffing reports; district HR reports","vacancy rate; applicants per opening; share of positions filled by fully certified teachers; long-term substitute usage","shortage is concentrated by subject/grade/geography rather than uniform, so aggregate 'teacher shortage' language can overstate a district's actual exposure","teacher_supply_pressure",high
H14,teacher shortage buffering without wage adjustment,staffing_dynamics,low,low,"Teacher staffing strain is often absorbed through long-term substitutes, emergency/provisional-certified hires, larger class sizes, or reduced program offerings rather than through base-wage increases, unlike police/fire overtime and callback which raise realized compensation paid to existing incumbent staff even without a base-wage change; substitute pay is typically well below a certified teacher's wage, so this buffering channel need not show up as increased personnel spending at all","long-term substitute; emergency certification; provisional license; under-certified; class size increase; unfilled position; program reduction; combined caseload","district staffing reports; school committee minutes; state education agency data; news","substitute usage/spending; class-size trends; share of positions filled by non-fully-certified teachers; program/course offering changes","some CBAs include class-size-overage stipends that would convert this into a wage-adjacent cost; substitute and onboarding costs are still real budget costs even if not wage costs","teacher_shortage_buffering",high
H15,teacher composition effect on observed average wages,measurement_composition,low,low,"District or region average teacher salary (e.g., as reported in Massachusetts DESE's Teacher Salaries Report) mixes elementary, middle, secondary, special education, vocational/technical, and bilingual/ESL teachers across the full experience distribution; a district with a higher share of elementary or early-career teachers can show a lower average teacher wage even if its step-and-lane salary schedule is not unusually low relative to peer districts, so naive teacher-vs-police/fire wage comparisons must control for composition rather than comparing raw averages","average teacher salary; FTE by grade level; experience distribution; step and lane placement","state education agency salary/staffing reports; district HR/personnel data; teacher union contracts","average salary by grade band and experience band; step/lane distribution; FTE composition","composition differences may themselves reflect labor-market or budget conditions (e.g., high turnover skewing a district young), not a pure measurement artifact","teacher_composition_effect",high
H16,teacher salary schedule rigidity and shortage-area pay,institutions,low,low,"Step-and-lane salary schedules set pay by years of experience and education credits, not by grade or subject, so a shortage in a specific subject (special education, math, science, bilingual/ESL) does not by default raise pay for teachers in that subject; roughly three in four surveyed districts (per NCTQ) offset this with stipends, bonuses, alternative schedules, or extra experience-step credit for hard-to-staff subjects, but about one in four apparently do not, and many such incentives are one-time bonuses or add-ons sitting outside the published base schedule rather than permanent base-wage increases","step and lane; salary schedule; hard-to-fill stipend; shortage-area bonus; extra experience credit; loan forgiveness; differentiated pay; MOU","district salary schedules; CBAs; NCTQ compensation reports; state teacher-pay policy summaries","presence/absence and size of shortage-area stipends; schedule structure (single schedule vs. subject-differentiated); one-time vs. permanent incentive design","subject-differentiated pay could reflect political/labor-relations bargaining outcomes as much as a market-clearing response to scarcity","teacher_salary_schedule_rigidity",high
H17,non-safety wage restraint via institutional/budget translation,institutions,medium,medium,"The police/fire vs. non-safety wage gap could grow not only because safety wages rise faster but because non-safety wage-setting institutions (school committee budgeting under municipal levy limits, absence of an interest-arbitration backstop, uniform multi-year salary schedules) convert comparable labor-market strain into buffering, service adjustment, or budget deferral rather than wage growth; teachers are a first, hard test case because they are credentialed, unionized, and politically salient, so if wage translation is still muted for them, it should be an even sharper contrast for less-salient non-safety units like clerical/admin; EXTENDED 2026-07-05 (see non_safety_clerical_admin_wage_mechanism_refinement_2026-07-05.md): clerical/admin is the 'plainest' test case, lacking both teachers' credentialing/salience cover and DPW's operational/licensing cover, so it isolates what wage-setting institutions (classification review, reclassification-not-across-the-board pattern, minimum-wage-driven compression, largely invisible service-backlog absorption) can restrain on their own; CITATION-AUDITED 2026-07-05 (see public_sector_impasse_arbitration_state_law_citation_audit_2026-07-05.md): Iowa's 2017 reform (House File 291, confirmed via primary source) illustrates a distinct, previously undocumented wage-restraint lever beyond anything in this project's Massachusetts corpus -- rather than removing arbitration availability, Iowa narrowed non-safety units' bargaining scope (mostly base wages only) and arbitration decision criteria (removing ability-to-pay and past-contract consideration, adding a mandatory public/private wage comparison) specifically for units under 30% public-safety composition, showing wage restraint can operate through scope/criteria restriction within a compulsory-arbitration system, not only through arbitration's absence","budget constraint; levy limit; override; state aid; competitive salary; peer districts; surrounding districts; unable to fund raise","school committee budgets; municipal finance documents; state aid formulas; teacher/DPW/clerical CBAs for comparison","wage growth by occupation class controlling for measured staffing strain (vacancy/applicant data) in the same city and period; frequency of budget override votes tied to compensation","non-safety units may simply have weaker bargaining power or genuinely smaller supply constraints rather than a distinct institutional-translation effect; fiscal capacity effects (H9) could look similar from the outside","non_safety_wage_restraint",high
