hypothesis_id,hypothesis_name,mechanism_family,police_relevance,fire_relevance,non_safety_relevance_or_counterpoint,expected_textual_signals,likely_source_types,possible_quant_data,confounds,proposed_gabriel_attribute,priority
H18,DPW operational essentiality as the strongest operational non-safety comparison,operational_comparison,low,low,"DPW shares real operational features with public safety (physical risk, licensure gating via CDL/hoisting/water-operator credentials, short-notice emergency response for storms and water-main breaks) that teaching and clerical work do not share, making it the strongest available operational (as opposed to credentialing/salience) non-safety comparison; if DPW wages still lag police/fire despite this operational similarity, that weakens a pure job-difficulty explanation for safety wage growth","CDL; hoisting license; water operator; wastewater operator; snow removal; storm response; water break; sewer emergency; road closure","DPW CBAs; municipal budgets; DPW annual reports; MA hoisting/water-operator licensing administrative pages","vacancy duration by DPW classification; overtime spending during storms; classification-tied credential premiums","DPW is not one occupation -- laborers, equipment operators, CDL drivers, water/wastewater operators, and mechanics have very different skill/scarcity profiles, so a single 'DPW' comparison risks the same composition confound already flagged for teachers","dpw_operational_essentiality",high
H19,DPW CDL and equipment operator scarcity,labor_market,low,low,"National reporting estimates a 60,000-80,000 truck-driver deficit (2024-2025) that DPW competes in via CDL roles, and Massachusetts requires a hoisting license (2-year renewal, exam- and medical-certification-based) for heavy-equipment operation; BUT the US BLS's own 2019 Monthly Labor Review analysis found no evidence of a secular truck-driver shortage, with real driver wages up only ~1.1% since 2010 -- a pattern inconsistent with chronic scarcity and more consistent with a retention/wage problem that industry associations have framed as a shortage since the late 1980s; water/wastewater operator certification is a stronger genuine scarcity case, with national and New England-regional (NEIWPCC) reporting describing 30-50% of the water workforce eligible to retire within 5-10 years","CDL; equipment operator; hoisting license; water operator; wastewater operator; hard to fill; shortage; retention -- capture whether shortage language co-occurs with flat or rising wages in the same document, to distinguish scarcity from a retention/wage-framing reading","BLS Monthly Labor Review; national trucking industry reporting; NEIWPCC and national water-workforce reporting; MA hoisting-license administrative pages; DPW job postings/CBAs","municipal CDL/equipment-operator classification wage growth vs. other municipal job classes; vacancy duration for licensed roles vs. laborer roles in the same department; certified water/wastewater operator vacancy and retirement data","CDL and hoisting licenses are general-purpose, privately-obtainable credentials shared with a very large private-sector labor pool, unlike academy/EMT credentials, so any associated scarcity is a shared market condition rather than a public-sector-specific bottleneck","dpw_cdl_equipment_operator_scarcity",high
H20,DPW contractor substitution,institutions,low,low,"Municipalities routinely substitute private contractors for DPW-type work (snow removal contracted in advance of winter; emergency contractor rates reported at roughly 3x normal during active events), a substitution option unavailable to police/fire for core response duties; Massachusetts prevailing wage law ties public-construction contractor wage rates to locally collectively bargained rates, so contracting out specific covered work does not simply undercut the wage paid for that work the way outsourcing might without such a law","private contractor; outsourcing; contracted services; prevailing wage; snow removal contract; retainer -- capture whether contractor-substitution language co-occurs with explicit prevailing-wage-coverage language, since coverage status changes what substitution implies about wages","MA Department of Labor Standards prevailing-wage guidance; municipal procurement/contract records; DPW annual reports","share of DPW-type work performed by contractors vs. in-house staff; prevailing-wage-coverage status by contract type; contractor cost premium during emergencies vs. routine work","routine service contracts (as opposed to public construction projects) may not always trigger prevailing-wage coverage, so the wage-floor protection should not be assumed to apply uniformly to every form of DPW contracting","dpw_contractor_substitution",medium_high
H21,DPW service deferral and delayed maintenance,staffing_dynamics,low,low,"DPW staffing strain can be buffered through deferred routine maintenance (a pothole patched later, a catch basin cleaned next quarter) rather than through wage growth, a channel unavailable to police/fire, which cannot defer an active emergency response; but deferred maintenance is not free -- it can convert into larger future capital costs, so the buffering may only be a timing shift, reappearing later as capital-budget pressure rather than true savings","delayed maintenance; service backlog; deferred maintenance; infrastructure; pavement condition; capital spending","municipal capital-improvement plans; DPW annual reports; local news on infrastructure failures","lagged relationship between documented DPW staffing strain and later capital spending or emergency capital appropriations","linking a staffing-strain period to a later capital-spending response with confidence about timing/causality is evidentiarily demanding and may not be feasible with a small corpus","dpw_service_deferral",medium_high
H22,DPW classification fragmentation,measurement_composition,low,low,"DPW's mix of laborers, several tiers of equipment operators, licensed water/wastewater operators, mechanics, and foremen means wage pressure concentrated in one classification does not automatically generalize to the whole department, directly analogous to the teacher composition effect (H15) but across job classifications within one department rather than within one job title; a single 'DPW wage' figure would blend an even wider skill/licensing spread than the elementary/secondary/special-education spread already flagged for teachers","classification; pay grade; step schedule; job grade; bargaining unit -- capture classification-specific wage-change language as distinct spans tagged by classification, not as a single DPW wage figure","DPW CBAs and classification/salary-grade schedules; municipal salary charts","classification-specific wage growth vs. department-wide average; whether a raise for one classification (e.g., licensed water operators) is followed by comparable raises for other DPW classifications in the same cycle","fragmentation could also amplify rather than mute wage response if internal-equity norms force parity increases across classifications once one classification gets a raise","dpw_classification_fragmentation",medium_high
H23,clerical/admin classification restraint,institutions,low,low,"Formal classification-and-compensation review systems restrain any single clerical/admin title's wage growth absent a reclassification finding or internal-equity adjustment; VERIFIED 2026-07-05 via full corpus read (see non_safety_clerical_admin_existing_corpus_scan_2026-07-05.md): Boston's clerical/admin CBA Article 33 'Compensation Grade Appeals' is the exclusive procedure for changing a position's grade, explicitly strips arbitrators of authority to change grade through an ordinary grievance, and limits any arbitration to whether the City's determination was 'arbitrary or capricious' -- not a full merits review -- with no retroactive remedy; classification systems exist across many occupations including this project's own DPW and police/fire corpus, so restraint per se is not clerical/admin-specific, but Boston's narrow arbitration standard is more restrictive than the grievance arbitration already documented for DPW","classification; classification and compensation unit; reclassification application; management rights to reorganize or reclassify; job grade","clerical/admin CBAs; municipal HR classification-office records; personnel board records","frequency and outcome of reclassification requests by occupation class, if comparable records exist across departments","classification systems are common across many occupations, so presence alone does not establish clerical/admin-specific restraint; would need comparative processing/approval-rate data","clerical_admin_classification_restraint",medium_high
H24,clerical/admin reclassification pressure,staffing_dynamics,low,low,"Because general wage increases in Massachusetts municipal CBAs are typically negotiated citywide or unit-wide (this project's Worcester corpus shows the clerical unit and the DPW clerks unit receiving the identical 2% annual pattern in the same cycle), a specific clerical title's pay problem is more likely addressed through a formal reclassification request than through renegotiation of the whole unit's wage schedule, which could make clerical/admin wage pressure less visible in aggregate wage-trend data than a police/fire comparator argument or a DPW licensing stipend; reclassification-driven change is not clerical/admin-specific -- this project's own DPW corpus already documents comparable 'working out of classification' and reclassification provisions in detail; VERIFIED 2026-07-05 (see non_safety_clerical_admin_existing_corpus_scan_2026-07-05.md): Boston's CGA process explicitly excludes 'perceived changes in job duties related to new technology, state or federal mandates, and/or to increases in the volume of work or duties' as valid reclassification grounds, stated twice in the contract (Articles 30 and 33) -- a direct, textual restraint on converting workload/automation-driven duty change into a reclassification-based raise, sharper than the general hypothesis anticipated","reclassification; out of classification; new duties; job description change; classification review","HR/classification office records; union grievance/reclassification files; CBAs","frequency and dollar impact of reclassification requests vs. across-the-board increases, by occupation class","reclassification-driven wage change may be no less visible than DPW's own documented reclassification provisions; distinguishing visibility requires comparative document review, not assumption","clerical_admin_reclassification_pressure",medium_high
H25,clerical/admin pay compression,fiscal_capacity,low,low,"Rising minimum wages compress the gap between entry-level and senior clerical/admin steps, requiring schedule-wide adjustment to preserve differentials; a Century Foundation analysis estimates the annual cost of raising all local-government workers above a $15 minimum wage threshold across six jurisdictions including Massachusetts at 0.2% (DC) to 1.0% (Illinois) of payroll per year, weighted average ~0.6%; compression pressure could be resolved by adjusting the whole schedule upward in tandem, which would not restrain wages at all, only require the schedule to move as a block","minimum wage; pay compression; salary inversion; schedule adjustment; entry step; top step","state minimum-wage law effective dates; municipal salary schedules over time; The Century Foundation minimum-wage-compression cost report","whether senior-step wages moved in tandem with entry-step increases (preserving differentials) or lagged (allowing compression) after a state minimum-wage increase","not directly applicable to police/fire, whose entry wages are typically well above minimum wage; requires multiple contract cycles per city to observe a compression trend, which this project's current single-cycle-per-city clerical corpus does not yet support","clerical_admin_pay_compression",medium_high
H26,clerical/admin service backlog absorption,staffing_dynamics,low,low,"Clerical/admin staffing shortfalls are absorbed through slower permit/records/payroll/benefits processing, reduced office hours, cross-training, or redistributed work among remaining staff rather than through wage growth, the clerical/admin analog to DPW's service deferral (H21) and teachers' shortage buffering (H14), but with even less wage-adjacent cost than either since clerical/admin work rarely involves overtime tied to an operational emergency; slower service could itself become politically salient if it affects a high-visibility function (elections, tax billing), so backlog absorption is not uniformly invisible","backlog; reduced hours; cross-training; redistributed work; slower processing; permit delay; records request delay","municipal annual reports; local news on service delays; council/select-board minutes","local news coverage or council/select-board attention to specific service delays compared with police/fire/DPW/teacher service failures of comparable severity","this project has not reviewed actual service-time or backlog data for any specific Massachusetts municipality, so this remains a hypothesis consistent with available evidence, not a demonstrated finding","clerical_admin_service_backlog_absorption",medium_high
H27,clerical/admin lower public salience,politics,low,low,"Clerical/admin staffing problems generally draw less sustained public/political attention than police, fire, teacher, or DPW problems because service delays (a slower permit, a longer records-request wait) are diffuse and individually low-stakes rather than single dramatic incidents; town/city clerk election-administration failures and treasurer/collector errors can carry acute legal and political consequences, so salience is function-dependent, not uniformly low, mirroring the same caution already applied to DPW's lower-public-salience hypothesis (H7 discussion)","statutory deadline; legal compliance; election administration; tax billing error -- capture whether clerical/admin mechanism text co-occurs with this kind of framing as a salience signal distinct from generic budget narrative","local news; council/select-board minutes; budget hearing transcripts","local news coverage volume and council/select-board attention to a clerical/admin service failure vs. a comparable-severity failure in another occupation class, in the same city and period","salience is hard to measure and may vary sharply by specific clerical/admin function (routine clerk work vs. election administration)","clerical_admin_lower_public_salience",medium
H28,library professional credentialing,training_credentials,low,low,"MLS/MLIS professional library degrees function as a real but unevenly applied and modest credential-to-pay mechanism; VERIFIED 2026-07-05 via full corpus read (see non_safety_library_wage_mechanism_and_corpus_scan_2026-07-05.md): Franklin's CBA Section 15.2 pays a permanent per-pay-period Educational Incentive with MLS/MLIS at the top tier ($73.08/pay period, $1,900/year), while Seekonk's CBA contains no degree/education language at all and Wayland treats a Master's degree only as an education-leave/tuition-reimbursement benefit, not a stipend; this uneven, city-by-city variation (even within this project's own three cities) is itself evidence that professional credentialing does not function as a universal, guaranteed wage floor the way teacher licensure does; national context (BLS: $64,320 median for Librarians vs. $17.31/hour for Library Assistants, Clerical, May 2024) shows a real occupational pay gap nationally, but public esteem for libraries should not be read as evidence this gap reflects strong wage-bargaining power for the credentialed tier specifically (esteem-is-not-power, the same caution already applied to firefighters and teachers)",MLS; MLIS; Master of Library Science; educational incentive; degree stipend; professional librarian; certification,library CBAs; MBLC librarian-certification records (605 CMR 3.00); BLS OOH/OEWS occupational data (national context only),presence/size/permanence of a degree-linked stipend by city; pay-grade placement of credentialed vs. non-credentialed titles within the same classification schedule,"a modest stipend is not the same claim as a separate, higher base-pay track; national BLS wage gaps do not establish anything about this project's own cities' internal pay structure",library_professional_credentialing,medium_high
H29,library classification and reclassification restraint,institutions,low,low,"Formal reclassification review systems restrain any single library title's wage growth absent a director-initiated finding, structurally near-identical to the DPW and clerical/admin reclassification mechanisms already documented; VERIFIED 2026-07-05 via full corpus read: Franklin (Section 14.9) and Wayland (Article 27) both describe a director-initiated review, an administrative-authority (Town Administrator or HR Manager) approval step, and a new-anniversary-date/step-increase-eligibility consequence; Seekonk's shorter contract has no comparable reclassification language at all; classification/reclassification systems are common across many municipal occupations already documented in this project's own corpus, so restraint per se is not library-specific — the distinguishing question, per DPW's and clerical/admin's already-flagged open comparison, is whether library's process is procedurally narrower or broader than the others, which this session did not test",reclassification; classification review; job classification; anniversary date; step increase following reclassification; working out of classification; temporary assignment to higher classification,library CBAs; municipal HR classification-office records,"frequency and outcome of library-specific reclassification requests, if comparable records exist across departments (not available in current corpus)",reclassification-driven wage change is not library-specific; distinguishing library's process from DPW's or clerical/admin's requires comparative procedural detail this session did not establish,library_classification_reclassification,medium_high
H30,"library part-time and page staffing as a structural, not exceptional, feature; volunteer-substitution contested",staffing_dynamics,low,low,"Part-time employment is confirmed, in all three of this project's library CBAs, as a permanent, contractually-defined core bargaining-unit category — a materially different staffing model than teachers (substitutes are a separate, non-unit labor pool) or DPW (seasonal staff are full-season temporary hires, not permanent part-time unit members); pages are confirmed explicitly excluded from bargaining-unit coverage at Franklin, meaning this project's corpus has no wage data for the most page-like tier; the volunteer-labor-substitution sub-hypothesis is CONTRADICTED, not confirmed, by the strongest available evidence: Franklin's Article 28 explicitly bars replacing bargaining-unit hours with volunteer help without union agreement, while Wayland's sole 'volunteer' mention describes staff self-scheduling for optional shifts (not external substitution) and Seekonk has no volunteer language at all — one bargaining unit has actively negotiated against the exact buffering channel this hypothesis proposes, which is itself informative",part-time; regular part-time; page; pages excluded; volunteer; volunteer help; hours replaced by volunteers; ten hours or more each week; prorated,library CBAs (already collected); municipal HR/personnel records for staffing-share trend data (not available),part-time share of total library headcount/hours over time (not testable with current single-cycle-per-city corpus); page/volunteer headcount and hours data (not available),the presence of a part-time category does not by itself establish it is used to buffer wage pressure rather than simply reflecting the library's inherent evening/weekend staffing model; one anti-substitution clause at one city does not establish volunteer substitution never occurs in Massachusetts libraries generally,library_part_time_volunteer_buffering,medium_high
H31,"library service deferral via reduced hours, branch, program, or acquisitions cuts",staffing_dynamics,low,low,"Library service can plausibly be deferred or reduced (hours, programming, acquisitions) rather than absorbed through wage growth, directly analogous to DPW's service deferral (H21) and clerical/admin's service-backlog absorption (H26); NOT FOUND in any of this project's three library CBAs (no hours-reduction, branch-closure, or acquisitions-cut language in the extracted text), consistent with the source-document-production-effects finding already independently replicated for DPW and clerical/admin — a labor CBA is not the document type that would typically contain this kind of service-level narrative, so absence from CBA text is not evidence the mechanism does not operate in practice",branch hours; service hours; reduced hours; branch closure; program cut; acquisitions; materials budget,"municipal library annual reports; MBLC ARIS compliance data; local news (illustrative only, not systematic proof)",hours-of-service or acquisitions-budget changes over time for a specific city's library (not available in current corpus),"CBA text is the wrong document type to look for this signal in, regardless of whether the underlying phenomenon occurs — absence here should not be read as evidence of absence in practice",library_service_deferral,medium
H32,sanitation route coverage pressure,staffing_dynamics,low,low,"A collection route's recurring, dated, individually-experienced coverage obligation is the sharpest non-safety analog to a police/fire response obligation this project has developed, sharper than DPW's more diffuse infrastructure-maintenance obligation; SCOPED 2026-07-05 (see non_safety_sanitation_solid_waste_mechanism_scope_2026-07-05.md; this project's corpus currently holds zero sanitation rows, so this is a scoping hypothesis, not a corpus-confirmed finding): unlike an active 911 response, route coverage is schedule-known and plannable well in advance and is substitutable by contractor/mutual-aid arrangements, so 'a recurring coverage obligation exists' does not by itself establish that missed coverage converts into wage pressure the way it might for police/fire; folds in a public-health/environmental-compliance discussion (solid waste collection has real regulatory backing via MA boards of health, but no MA source found ties that authority to a wage-setting or wage-floor consequence specifically, unlike teachers' Chapter 70 or library's MBLC mechanisms)",route; route coverage; missed pickup; service frequency; public health; environmental compliance; board of health,municipal solid-waste annual reports; a future sanitation-inclusive CBA (none currently collected); MassDEP solid-waste program materials,whether a documented missed-route event generates overtime/contractor-call-in/wage-relevant response versus simple one-day absorption (not available in current corpus),"route coverage is more schedule-predictable and substitutable than an emergency response, unlike the zero-deferability that distinguishes police/fire coverage; presence of a plausible pressure is not evidence of an actual wage response without contract-specific language",sanitation_route_coverage_pressure,medium
H33,sanitation contractor and private-hauler substitution,institutions,low,low,"Private-hauler substitution is confirmed, via multiple Massachusetts municipal examples, to function as a complete, year-round, primary-service alternative to municipal provision, not merely a supplemental capacity mechanism the way DPW's contractor use is; SCOPED AND EXTERNALLY CONFIRMED 2026-07-05 (see non_safety_sanitation_solid_waste_mechanism_scope_2026-07-05.md sec 7, 9): the towns of Dedham, Andover, Marshfield, and Brookline are each confirmed, via their own municipal web pages, to use private-hauler arrangements for some or all residential collection; this session explicitly treats the mechanism as potentially reflecting genuine private-sector wage competition (an upward-pressure reading) as easily as wage-restraint via substitution (a downward-pressure reading) rather than assuming either direction, since academic privatization-cost research reviewed this session is genuinely mixed (some studies find no systematic cost advantage to privatization, or find it raises costs in small municipalities specifically, while intermunicipal cooperation is reported to reduce costs more consistently, by over 25% in at least one cited study) — a contested cost record, not a settled 'outsourcing saves money' finding",private hauler; contractor; outsourcing; hauling contract; tipping fee; municipal solid waste,municipal procurement records; town meeting/select-board minutes; academic privatization-cost literature; individual municipal trash-collection web pages (a confirmed reliable source this session),whether a specific documented outsourcing decision cites cost/wage rationale explicitly; cost/wage outcomes compared against a similar non-contracted municipality (not available),"contracting out removes a city's sanitation wage question from this project's municipal-CBA-based comparison framework entirely, rather than restraining a municipal wage that continues to exist — a genuinely different effect than wage restraint on an ongoing municipal bargaining unit; MA prevailing-wage coverage of routine hauling service contracts (as distinct from public-construction projects) was not independently verified this session",sanitation_contractor_substitution,high
