hypothesis_id,hypothesis_name,mechanism_family,police_relevance,fire_relevance,non_safety_relevance_or_counterpoint,expected_textual_signals,likely_source_types,possible_quant_data,confounds,proposed_gabriel_attribute,priority
H21,DPW service deferral and delayed maintenance,staffing_dynamics,low,low,"DPW staffing strain can be buffered through deferred routine maintenance (a pothole patched later, a catch basin cleaned next quarter) rather than through wage growth, a channel unavailable to police/fire, which cannot defer an active emergency response; but deferred maintenance is not free -- it can convert into larger future capital costs, so the buffering may only be a timing shift, reappearing later as capital-budget pressure rather than true savings","delayed maintenance; service backlog; deferred maintenance; infrastructure; pavement condition; capital spending","municipal capital-improvement plans; DPW annual reports; local news on infrastructure failures","lagged relationship between documented DPW staffing strain and later capital spending or emergency capital appropriations","linking a staffing-strain period to a later capital-spending response with confidence about timing/causality is evidentiarily demanding and may not be feasible with a small corpus","dpw_service_deferral",medium_high
H22,DPW classification fragmentation,measurement_composition,low,low,"DPW's mix of laborers, several tiers of equipment operators, licensed water/wastewater operators, mechanics, and foremen means wage pressure concentrated in one classification does not automatically generalize to the whole department, directly analogous to the teacher composition effect (H15) but across job classifications within one department rather than within one job title; a single 'DPW wage' figure would blend an even wider skill/licensing spread than the elementary/secondary/special-education spread already flagged for teachers","classification; pay grade; step schedule; job grade; bargaining unit -- capture classification-specific wage-change language as distinct spans tagged by classification, not as a single DPW wage figure","DPW CBAs and classification/salary-grade schedules; municipal salary charts","classification-specific wage growth vs. department-wide average; whether a raise for one classification (e.g., licensed water operators) is followed by comparable raises for other DPW classifications in the same cycle","fragmentation could also amplify rather than mute wage response if internal-equity norms force parity increases across classifications once one classification gets a raise","dpw_classification_fragmentation",medium_high
H23,clerical/admin classification restraint,institutions,low,low,"Formal classification-and-compensation review systems restrain any single clerical/admin title's wage growth absent a reclassification finding or internal-equity adjustment; VERIFIED 2026-07-05 via full corpus read (see non_safety_clerical_admin_existing_corpus_scan_2026-07-05.md): Boston's clerical/admin CBA Article 33 'Compensation Grade Appeals' is the exclusive procedure for changing a position's grade, explicitly strips arbitrators of authority to change grade through an ordinary grievance, and limits any arbitration to whether the City's determination was 'arbitrary or capricious' -- not a full merits review -- with no retroactive remedy; classification systems exist across many occupations including this project's own DPW and police/fire corpus, so restraint per se is not clerical/admin-specific, but Boston's narrow arbitration standard is more restrictive than the grievance arbitration already documented for DPW","classification; classification and compensation unit; reclassification application; management rights to reorganize or reclassify; job grade","clerical/admin CBAs; municipal HR classification-office records; personnel board records","frequency and outcome of reclassification requests by occupation class, if comparable records exist across departments","classification systems are common across many occupations, so presence alone does not establish clerical/admin-specific restraint; would need comparative processing/approval-rate data","clerical_admin_classification_restraint",medium_high
H24,clerical/admin reclassification pressure,staffing_dynamics,low,low,"Because general wage increases in Massachusetts municipal CBAs are typically negotiated citywide or unit-wide (this project's Worcester corpus shows the clerical unit and the DPW clerks unit receiving the identical 2% annual pattern in the same cycle), a specific clerical title's pay problem is more likely addressed through a formal reclassification request than through renegotiation of the whole unit's wage schedule, which could make clerical/admin wage pressure less visible in aggregate wage-trend data than a police/fire comparator argument or a DPW licensing stipend; reclassification-driven change is not clerical/admin-specific -- this project's own DPW corpus already documents comparable 'working out of classification' and reclassification provisions in detail; VERIFIED 2026-07-05 (see non_safety_clerical_admin_existing_corpus_scan_2026-07-05.md): Boston's CGA process explicitly excludes 'perceived changes in job duties related to new technology, state or federal mandates, and/or to increases in the volume of work or duties' as valid reclassification grounds, stated twice in the contract (Articles 30 and 33) -- a direct, textual restraint on converting workload/automation-driven duty change into a reclassification-based raise, sharper than the general hypothesis anticipated","reclassification; out of classification; new duties; job description change; classification review","HR/classification office records; union grievance/reclassification files; CBAs","frequency and dollar impact of reclassification requests vs. across-the-board increases, by occupation class","reclassification-driven wage change may be no less visible than DPW's own documented reclassification provisions; distinguishing visibility requires comparative document review, not assumption","clerical_admin_reclassification_pressure",medium_high
H25,clerical/admin pay compression,fiscal_capacity,low,low,"Rising minimum wages compress the gap between entry-level and senior clerical/admin steps, requiring schedule-wide adjustment to preserve differentials; a Century Foundation analysis estimates the annual cost of raising all local-government workers above a $15 minimum wage threshold across six jurisdictions including Massachusetts at 0.2% (DC) to 1.0% (Illinois) of payroll per year, weighted average ~0.6%; compression pressure could be resolved by adjusting the whole schedule upward in tandem, which would not restrain wages at all, only require the schedule to move as a block","minimum wage; pay compression; salary inversion; schedule adjustment; entry step; top step","state minimum-wage law effective dates; municipal salary schedules over time; The Century Foundation minimum-wage-compression cost report","whether senior-step wages moved in tandem with entry-step increases (preserving differentials) or lagged (allowing compression) after a state minimum-wage increase","not directly applicable to police/fire, whose entry wages are typically well above minimum wage; requires multiple contract cycles per city to observe a compression trend, which this project's current single-cycle-per-city clerical corpus does not yet support","clerical_admin_pay_compression",medium_high
H26,clerical/admin service backlog absorption,staffing_dynamics,low,low,"Clerical/admin staffing shortfalls are absorbed through slower permit/records/payroll/benefits processing, reduced office hours, cross-training, or redistributed work among remaining staff rather than through wage growth, the clerical/admin analog to DPW's service deferral (H21) and teachers' shortage buffering (H14), but with even less wage-adjacent cost than either since clerical/admin work rarely involves overtime tied to an operational emergency; slower service could itself become politically salient if it affects a high-visibility function (elections, tax billing), so backlog absorption is not uniformly invisible","backlog; reduced hours; cross-training; redistributed work; slower processing; permit delay; records request delay","municipal annual reports; local news on service delays; council/select-board minutes","local news coverage or council/select-board attention to specific service delays compared with police/fire/DPW/teacher service failures of comparable severity","this project has not reviewed actual service-time or backlog data for any specific Massachusetts municipality, so this remains a hypothesis consistent with available evidence, not a demonstrated finding","clerical_admin_service_backlog_absorption",medium_high
H27,clerical/admin lower public salience,politics,low,low,"Clerical/admin staffing problems generally draw less sustained public/political attention than police, fire, teacher, or DPW problems because service delays (a slower permit, a longer records-request wait) are diffuse and individually low-stakes rather than single dramatic incidents; town/city clerk election-administration failures and treasurer/collector errors can carry acute legal and political consequences, so salience is function-dependent, not uniformly low, mirroring the same caution already applied to DPW's lower-public-salience hypothesis (H7 discussion)","statutory deadline; legal compliance; election administration; tax billing error -- capture whether clerical/admin mechanism text co-occurs with this kind of framing as a salience signal distinct from generic budget narrative","local news; council/select-board minutes; budget hearing transcripts","local news coverage volume and council/select-board attention to a clerical/admin service failure vs. a comparable-severity failure in another occupation class, in the same city and period","salience is hard to measure and may vary sharply by specific clerical/admin function (routine clerk work vs. election administration)","clerical_admin_lower_public_salience",medium
