approval_status,state,city,source_role,source_target,source_url_or_lookup_path,source_family,proposed_use,proposed_corpus,proposed_contract_id,proposed_occupation_class,proposed_source_type,proposed_retrieval_method,proposed_text_quality,proposed_filename,mechanism_or_claim_supported,priority,reason,caveat,fetch_instruction,ingest_instruction,notes
backup,TX,Fort Worth,police,Fort Worth Police Officers Association meet-and-confer agreement,https://www.fortworthtexas.gov/departments/citysecretary/events/collective-bargaining-fire-2024 (police-specific current-cycle URL not directly located),cba,causal_evidence,causal,tx_fort_worth_police_2024 (tentative),police,cba,public_download,unknown,corpus/tx_fort_worth/tx_fort_worth_fwpoa_police_meet_confer.pdf,"Independently corroborates the fire-full-bargaining/police-meet-and-confer split found in Houston and Austin, in a third city",useful,Would independently confirm the fire/police split pattern generalizes beyond Houston and Austin,"Current-cycle full agreement text not directly located this session, only referenced via city event pages -- confirm exact URL before fetch",Do not fetch unless promoted to the first batch,Do not ingest until promoted,A 2017-2020 predecessor with salary schedule was located and could serve as a fallback if the current version proves hard to locate
backup,TX,Fort Worth,fire,Fort Worth Professional Firefighters Association collective bargaining contract,https://www.fortworthtexas.gov/departments/citysecretary/events/collective-bargaining-fire-2024 (full-text URL not directly located),cba,causal_evidence,causal,tx_fort_worth_fire_2024 (tentative),fire,cba,public_download,unknown,corpus/tx_fort_worth/tx_fort_worth_fwpffa_fire_cba.pdf,Completes a potential Fort Worth matched police/fire pair under the same institutional split as Houston/Austin,useful,Same backup rationale as the Fort Worth police row above,Full agreement text not directly located this session,Do not fetch unless promoted to the first batch,Do not ingest until promoted,See texas_ohio_multicity_pre_ingestion_scan_2026-07-08.md Sec.3 (Fort Worth)
backup,OH,Cincinnati,police,"FOP Queen City Lodge No. 69 collective bargaining agreements (non-supervisors + supervisors, 2024-2027)",https://www.cincinnati-oh.gov/hr/labor-relations/,cba,causal_evidence,causal,oh_cincinnati_police_2024 (tentative),police,cba,public_download,unknown,corpus/oh_cincinnati/oh_cincinnati_fop_qcl69_police_cba_2024_2027.pdf,"Equally complete alternative to Cleveland as a second Ohio city, with a non-supervisor/supervisor police split",useful,Strong alternative second Ohio city if Cleveland acquisition is deferred or supplemented,None material identified,Do not fetch unless promoted to the first batch,Do not ingest until promoted,"Includes two distinct bargaining units (non-supervisors, supervisors) -- confirm which or both before promoting"
backup,OH,Cincinnati,fire,IAFF Local 48 collective bargaining agreement (2023-2026),https://www.cincinnati-oh.gov/hr/labor-relations/fire-contract-2023-2026/,cba,causal_evidence,causal,oh_cincinnati_fire_2023 (tentative),fire,cba,public_download,unknown,corpus/oh_cincinnati/oh_cincinnati_iaff48_fire_cba_2023_2026.pdf,Completes a potential Cincinnati matched police/fire pair,useful,Same backup rationale as the Cincinnati police row above,None material identified,Do not fetch unless promoted to the first batch,Do not ingest until promoted,See texas_ohio_multicity_pre_ingestion_scan_2026-07-08.md Sec.5 (Cincinnati)
backup,OH,Cincinnati,non_safety_general,CODE and Teamsters collective bargaining agreements (2025-2028),https://cincyweb.cincinnati-oh.gov/hr/labor-relations/code-contract-2025-2028/,cba,causal_evidence,causal,oh_cincinnati_other_2025 (tentative),other,cba,public_download,unknown,corpus/oh_cincinnati/oh_cincinnati_code_teamsters_cba_2025_2028.pdf,Matched non-safety comparison unit for a potential Cincinnati acquisition,useful,Two distinct non-safety unions confirmed on one official portal -- a genuine strength if Cincinnati is promoted,Occupation-class composition of both unions not yet read in depth,Do not fetch unless promoted to the first batch,Do not ingest until promoted,See texas_ohio_multicity_pre_ingestion_scan_2026-07-08.md Sec.5 (Cincinnati)
backup,OH,Toledo,police,Toledo Police Command Officers Association (TPCOA) and Patrolman's Association agreements,https://cdn.toledo.oh.gov/uploads/documents/Human-Resources/Collective-Bargaining-Agreements/,cba,causal_evidence,causal,oh_toledo_police_2021 (tentative),police,cba,public_download,unknown,corpus/oh_toledo/oh_toledo_tpcoa_patrolman_police_cba_2021_2024.pdf,"Richest non-safety union variety of any city scanned, if promoted, at the cost of more complex occupation-class mapping",optional,Third-choice Ohio backup; strongest non-safety union variety but added mapping complexity,Current-cycle full text for the Patrolman's Association not directly confirmed this session,Do not fetch unless promoted to the first batch,Do not ingest until promoted,See texas_ohio_multicity_pre_ingestion_scan_2026-07-08.md Sec.5 (Toledo)
backup,OH,Toledo,fire,IAFF Local 92 and Toledo Fire Chiefs Association agreements,https://cdn.toledo.oh.gov/uploads/documents/Human-Resources/Collective-Bargaining-Agreements/,cba,causal_evidence,causal,oh_toledo_fire_2021 (tentative),fire,cba,public_download,unknown,corpus/oh_toledo/oh_toledo_iaff92_fire_cba.pdf,Completes a potential Toledo matched police/fire pair,optional,Same backup rationale as the Toledo police row above,Full text not directly confirmed this session,Do not fetch unless promoted to the first batch,Do not ingest until promoted,See texas_ohio_multicity_pre_ingestion_scan_2026-07-08.md Sec.5 (Toledo)
backup,OH,Toledo,non_safety_general,"AFSCME Locals 7/2058/3411, Teamsters Local 20, and UAW Local 12 agreements",https://cdn.toledo.oh.gov/uploads/documents/Human-Resources/Collective-Bargaining-Agreements/,cba,causal_evidence,causal,"oh_toledo_other_2021 (tentative -- multiple distinct units, would need per-union contract_ids)",other,cba,public_download,unknown,corpus/oh_toledo/oh_toledo_afscme_multi_union_non_safety_cba.pdf,Richest non-safety union variety of any city scanned in either state; a strong test of this project's occupation_class mapping discipline across multiple simultaneous units,optional,Would require careful per-union occupation-class mapping given the number of distinct non-safety bargaining units,Multiple distinct non-safety units exist -- do not treat as one document/one contract_id if promoted,Do not fetch unless promoted to the first batch,Do not ingest until promoted,See texas_ohio_multicity_pre_ingestion_scan_2026-07-08.md Sec.5 (Toledo)
defer,TX,Dallas,other,"Joint police+fire Meet and Confer Agreement (Ch.142, not Ch.174)",https://www.lris.com/wp-content/uploads/contracts/dallas_tx_combo.pdf,cba,causal_evidence,causal,"tx_dallas_police_fire_joint (tentative -- unusual joint-unit structure, may need a design decision on how to split into occupation_class rows)",other,cba,public_download,unknown,corpus/tx_dallas/tx_dallas_joint_police_fire_meet_confer.pdf,"Useful contrast for a joint (not split) police+fire meet-and-confer model, and a non-safety population with no confirmed statutory channel at all",optional,Deferred pending Houston/Austin/Fort Worth/San Antonio sourcing work; would need its own dedicated verification pass and a design decision on the joint-agreement structure,No official-city-hosted full-text copy independently confirmed yet (aggregator/Ballotpedia copies only); non-safety statutory channel absent entirely,Do not fetch,Do not ingest,NTAPE Local 9487 (USW) and CWA Local 6215 exist as employee organizations but neither was confirmed to have Ch.146-equivalent legal bargaining status
defer,TX,El Paso,other,El Paso Municipal Police Officers' Association CBA (2023-2027),https://www.cleat.org/wp-content/uploads/2024/05/El-Paso-MPOA_CBA-2023.pdf,union_contract_page,source_discovery,unknown,not_applicable,police,other,other,unknown,corpus/tx_el_paso/tx_el_paso_mpoa_police_cba_2023_2027.pdf (tentative),Corroborates that Ch.174 adoption is common across many Texas cities beyond the five core cities scanned,optional,"Added only for breadth; institutional status rests on secondary sourcing only and the located CBA is union-hosted, not an official city copy",Institutional status (Ch.174 adoption) rests on a secondary bill-analysis source only; not independently verified to this project's usual standard,Do not fetch,Do not ingest,Not recommended as a near-term acquisition target
defer,OH,Akron,other,Akron police (FOP) and fire (Akron Fire Fighters Association) status -- no current CBA located,not located this session,other,source_discovery,unknown,not_applicable,not_applicable,other,not_applicable,not_applicable,not_applicable,"An active, unresolved fire-department impasse is documented in local news -- analytically interesting but the weakest-documented Ohio city in this scan",optional,"The live fire-department impasse is a genuinely interesting future data point (an impasse in progress, which this project does not yet have an example of for any city), but no current CBA was located for any tier this session","No current, officially-hosted CBA located for police, fire, or non-safety; current non-safety union status entirely unconfirmed",Do not fetch,Do not ingest,Needs a dedicated follow-up search of an Akron-specific city HR/labor-relations page and the SERB archive filtered by 'Akron' before this city could be considered acquisition-ready
defer,OH,Dayton,non_safety_general,Dayton Public Service Union (DPSU)/AFSCME collective bargaining agreement (2020-2023),https://www.daytonohio.gov/DocumentCenter/View/3954/DPSU-2020-2023,cba,causal_evidence,causal,oh_dayton_other_2020 (tentative),other,cba,public_download,unknown,corpus/oh_dayton/oh_dayton_dpsu_afscme_cba_2020_2023.pdf,A genuine correction to a prior session's pessimistic assessment -- Dayton does have an official city Document Center hosting at least a non-safety CBA,optional,"Moderate-confidence third/fourth-choice Ohio backup; police-specific official source not yet located, limiting this city's readiness",Police-specific official source not yet located; exact identity of two located SERB fact-finding reports not confirmed,Do not fetch unless promoted to the first batch,Do not ingest until promoted,IAFF Local 136 fire CBA is SERB-hosted (dam.assets.ohio.gov/.../24-CON-07-1715.pdf) but a police-specific source is still missing
