state,city_or_jurisdiction,candidate_reason,police_source_targets,fire_source_targets,non_safety_source_targets,budget_or_hr_source_targets,institutional_notes,likely_data_availability,expected_comparison_value,risks_or_caveats,priority,fetch_later,notes
TX,Houston,"REVISED 2026-07-08: confirmed the strongest candidate in either state -- Ch. 174 full bargaining WITH population-triggered compulsory arbitration (Sec.174.1535, municipalities >=1.9M, Houston-only) for fire; Ch. 142 non-compulsory meet-and-confer for police; Ch. 146 non-compulsory meet-and-confer (also population-triggered, >=1.5M, Houston-only) for non-safety employees -- three distinct institutional tiers in one city",Houston Police Officers' Union (HPOU) Meet & Confer Agreement -- an official houstontx.gov-hosted copy located 2026-07-08 (houstontx.gov/hr/hrfiles/classified_testing/agreement_meet_conf.pdf); current-version status not yet confirmed against a reported 2024-2025 ratified successor,"HPFFA/IAFF Local 341 CBA 2024-2029 (Ch. 174 + Sec.174.1535 mandatory arbitration; official houstontx.gov Mayor's Office and Council-committee pages located 2026-07-08, full-CBA-vs-settlement-summary status not disambiguated); a possibly-distinct Houston Fire Officers' Association CBA also identified (hfdcoa.org, not yet an official city copy)","REVISED 2026-07-08: confirmed PRESENT, reversing the prior assessment -- HOPE/AFSCME Local 123 has been Houston's Ch. 146 non-safety meet-and-confer bargaining agent since 2008 (12,000+ members, reportedly spanning most city departments); 2024 agreement officially hosted at houstontx.gov/hr/hrfiles/employee_relations/hope_meet_cof_agrmnt.pdf",houstontx.gov/hr job-classification and compensation pages; Municipal Employee Guidebook PDF (houstontx.gov/hr/hrfiles/employee_relations) -- now understood to operate ALONGSIDE, not instead of, the HOPE meet-and-confer relationship,"Ch. 146 and Sec.174.1535 both directly confirmed 2026-07-08 via fetch-and-read of the actual statute text -- see texas_ohio_legal_followup_source_audit_2026-07-08.md Secs 2-3",high,"Tests the sharpest and richest form of the Texas contrast: a compulsory-arbitration fire unit, a non-compulsory police unit, and a non-compulsory (but real) non-safety bargaining unit, all in one city -- a within-city institutional range this project's Massachusetts corpus does not have",None of the located official Houston PDFs extracted as readable text this session (tooling limitation, not a document-quality finding); HFOA-vs-HPFFA relationship and HOPE's exact department/classification list still need confirmation,must_have,yes,"REVISED 2026-07-08: do not fetch yet; see texas_ohio_source_ingestion_audit_2026-07-08.csv for the specific document-level targets and texas_ohio_legal_followup_source_audit_2026-07-08.md Sec.4/8 for remaining pre-ingestion checks"
TX,San Antonio,"Only large Texas city confirmed this session to use full Ch. 174 collective bargaining (not meet-and-confer) for police, the closer-in-form (though not compulsion) analogue to Massachusetts; a 2021 Prop B ballot fight over repealing Ch. 174 adds a documented public-salience data point",San Antonio Police Officers Association CBA 2022-2026 (posted at sanantonio.gov/Portals/0/Files/Atty/CollectiveBargaining/Police/),San Antonio Fire Fighters Association CBA (a CBA-SAFD.pdf was located at sanantonio.gov this session; cycle dates not yet confirmed),"Not yet identified -- San Antonio's non-safety bargaining/Ch. 146 status was not confirmed this session",sanantonio.gov City Attorney Collective Bargaining page (central portal for both police and fire CBAs),"Central, dedicated 'Collective Bargaining' page at sanantonio.gov/City-Attorney/CollectiveBargaining hosting both current and historical police/fire agreements -- best-organized Texas municipal portal found this session",high,"Tests whether full Ch. 174 collective bargaining (still non-compulsory-arbitration) produces different wage-mechanism text than Houston's/Austin's lighter meet-and-confer model, and offers a concrete public-salience event (Prop B) for future discourse-corpus work",Prop B (2021) shows San Antonio's police bargaining status itself was a live, contested political question in the last decade -- do not treat current Ch. 174 status as a settled, permanent institutional fact,must_have,yes,"Do not fetch; confirm non-safety comparison unit availability before treating this city as verified per this project's CBA source verification standard"
TX,Austin,"Meet-and-confer city (Ch. 142) with both police and fire agreements posted on a dedicated, well-organized official city labor-relations portal; useful within-Texas contrast to Houston/San Antonio",Austin Police Association meet-and-confer agreement 2024-2029 (austintexas.gov/department/labor-relations/police-meet-and-confer-agreement),Austin Firefighters Association Local 975 CBA 2023-2025, plus a proposed tentative successor CBA released October 2025 (austintexas.gov/department/labor-relations/fire-collective-bargaining-agreement),"Not yet identified -- Austin's non-safety bargaining/Ch. 146 status was not confirmed this session; Austin's EMS meet-and-confer agreement (a public-safety-adjacent, not non-safety, unit) was noted but not reviewed in depth",austintexas.gov/department/labor-relations (central portal),"Best-organized single-city labor-relations portal found this session across either state -- separate, current pages for police, fire, and EMS meet-and-confer agreements",high,"A third Texas meet-and-confer data point with the most complete, most current online documentation found this session; the EMS meet-and-confer agreement is a further public-safety-adjacent comparison this project has not previously had a non-Massachusetts example of",Non-safety comparison unit not yet identified; do not assume one exists without a Ch. 146 check,useful,yes,"Do not fetch; strong logistical candidate once a non-safety comparison unit (or an explicit civil-service-pay-plan substitute) is confirmed"
TX,Dallas,"Listed among Texas's meet-and-confer cities (Ch. 142) alongside Austin and Fort Worth; not independently source-verified this session beyond that classification",Dallas Police Association meet-and-confer agreement (existence reported via secondary aggregation this session; not independently located on an official dallascityhall.com page),Dallas Fire Fighters Association meet-and-confer agreement (same caveat as police),Not yet identified,Not yet identified,"Classification as a meet-and-confer city is secondary-sourced this session (a web-search synthesis, not an official Dallas city page); needs independent confirmation before treating as verified",unknown,medium,"A fourth Texas data point if Houston/Austin/San Antonio acquisition proves productive, but not yet independently verified at the level of this project's other Texas candidates",Institutional classification not yet confirmed via a primary Dallas city source this session,optional,maybe,"Defer until Houston/Austin/San Antonio sourcing work is complete; would need its own dedicated verification pass"
TX,Fort Worth,"Listed among Texas's meet-and-confer cities (Ch. 142) alongside Austin and Dallas; also not independently source-verified this session beyond that classification",Fort Worth Police Officers Association meet-and-confer agreement (existence reported via secondary aggregation; not independently located on an official fortworthtexas.gov page),Fort Worth Fire Fighters Association meet-and-confer agreement (same caveat as police),Not yet identified,Not yet identified,"Same secondary-sourcing caveat as Dallas -- meet-and-confer adoption reported to date to 2001 per a secondary bill-analysis source, not independently re-confirmed this session",unknown,medium,"A fifth possible Texas data point, lowest-confidence of the five Texas cities scanned this session",Institutional classification not yet confirmed via a primary Fort Worth city source this session,optional,maybe,"Defer; lowest-priority Texas city in this scan"
OH,Columbus,"REVISED 2026-07-08: confirmed top Ohio candidate -- all four identifiable tiers (police, fire, two non-safety unions) now confirmed on one centralized, official columbus.gov portal, cross-checkable against Ohio's statewide SERB archive",Fraternal Order of Police Capital City Lodge No. 9 CBA 2023-2026 (columbus.gov/files/sharedassets/city/v/1/human-resources/labor-relations/fop-cba-2023-2026.pdf; a matching copy is also filed with SERB at dam.assets.ohio.gov/.../serb.ohio.gov/PDF/Contracts/2020/20-MED-08-0826.pdf for a related/prior docket),"REVISED 2026-07-08: confirmed -- IAFF Local 67 CBA 2023-2026, official columbus.gov copy (columbus.gov/files/sharedassets/city/v/2/human-resources/labor-relations/iaff-cba-2023-2026.pdf), ~1,700 uniformed Division of Fire employees; a matching SERB fact-finding report (23-MED-07-0560) also located for cross-check","REVISED 2026-07-08: confirmed -- AFSCME Local 1632 CBA 2024-2027 (columbus.gov/files/sharedassets/city/v/1/human-resources/labor-relations/afscme-1632-cba-2024-2027.pdf) and a second non-safety/technical CWA CBA 2023-2026 (columbus.gov/.../cwa-2023-2026-cba.pdf); exact occupation-class composition of each not yet read in depth",columbus.gov/Government/Departments/Human-Resources/Labor-Relations (central portal); a Health Administrative Compensation Plan (HACP) pay-plan PDF also located (columbus.gov/.../hacp.03.17.2024.pdf) for non-bargaining-unit employees,"REVISED 2026-07-08: four of the reported 'six' contracts now specifically identified and confirmed official; remaining two not identified but not a blocker -- see texas_ohio_legal_followup_source_audit_2026-07-08.md Sec.6",high,"Best-documented single-city 'matched safety and non-safety, one portal' candidate found in either state -- now the confirmed top Ohio acquisition target",AFSCME Local 1632's and CWA's exact occupation-class composition not yet confirmed via a direct recognition-clause read,must_have,yes,"REVISED 2026-07-08: do not fetch yet; see texas_ohio_source_ingestion_audit_2026-07-08.csv for document-level targets"
OH,Cincinnati,"Confirmed active CBA portal (cincinnati-oh.gov/hr/labor-relations) with multiple current (2025-2028) contracts already posted, including at least one clearly non-safety union (CODE -- Cincinnati Organized and Dedicated Employees; Teamsters)",Cincinnati Fraternal Order of Police CBA (not directly pulled this session; expected on the same cincinnati-oh.gov/hr/labor-relations portal alongside the CODE and Teamsters contracts found),Cincinnati firefighters' union CBA (not directly pulled this session; same portal expected),"CODE (Cincinnati Organized and Dedicated Employees) contract 2025-2028 (cincyweb.cincinnati-oh.gov/hr/labor-relations/code-contract-2025-2028/); Teamsters contract 2025-2028 (cincinnati-oh.gov/hr/labor-relations/teamsters-contract-2025-2028/) -- both are plausible non-safety matched units, exact bargaining-unit composition not yet confirmed",cincinnati-oh.gov/hr/labor-relations (central portal),"Directly confirmed this session to host at least a non-safety CODE contract and a Teamsters contract, both current (2025-2028); police/fire contracts on the same portal were not directly pulled but are plausible given the portal's structure",high,"The Ohio city with the clearest already-confirmed non-safety CBA availability (CODE, Teamsters) found this session -- directly useful for this project's matched-comparison design discipline",CODE's and Teamsters' specific job/occupation-class composition (clerical vs. public-works vs. mixed) not yet confirmed -- needs a direct read before classifying under this project's controlled occupation_class vocabulary,must_have,yes,"Do not fetch; confirm CODE's and Teamsters' occupation composition and locate the police/fire contracts on the same portal before acquisition"
OH,Cleveland,"A dedicated, named 'Collective Bargaining Agreements' page exists on the official city HR site, suggesting centralized organization similar to Columbus/Cincinnati",Cleveland Police Patrolmen's Association CBA (expected on clevelandohio.gov/city-hall/departments/human-resources/collective-bargaining-agreements; not directly pulled this session),Cleveland fire union CBA (same page, not directly pulled this session),"Not yet identified -- non-safety contract titles on this page were not enumerated this session",clevelandohio.gov/city-hall/departments/human-resources/collective-bargaining-agreements (central portal),"Portal's existence and title confirmed; specific contracts listed on it were not enumerated this session",medium,"A third strong Ohio candidate if Columbus/Cincinnati sourcing needs a supplementary or comparison city",Portal contents not yet enumerated; treat as a plausible, not yet verified, candidate,useful,maybe,"Would need a direct page visit to enumerate available contracts before treating as verified"
OH,Dayton,"Suggested by the PI's candidate list; no comparably centralized public labor-relations portal surfaced in this session's bounded search",Not identified this session,Not identified this session,Not identified this session,Not identified this session -- a direct dayton.gov site visit was not performed this session,"Lower confidence than Columbus/Cincinnati/Cleveland -- a comparable portal may exist but did not surface in this session's search terms",low,"Would need its own dedicated search pass; not prioritized given three stronger Ohio candidates already identified",No source located this session -- do not assume unavailability, only that this session's bounded search did not surface a portal,optional,maybe,"Defer pending a dedicated follow-up search of dayton.gov and/or SERB's filed-contract archive for Dayton-specific dockets"
OH,Akron,"Suggested by the PI's candidate list; no comparably centralized public labor-relations portal surfaced in this session's bounded search",Not identified this session,Not identified this session,Not identified this session,Not identified this session -- a direct akronohio.gov site visit was not performed this session,"Same low-confidence status as Dayton -- a comparable portal may exist but did not surface in this session's search terms",low,"Would need its own dedicated search pass; not prioritized given three stronger Ohio candidates already identified",No source located this session -- do not assume unavailability, only that this session's bounded search did not surface a portal,optional,maybe,"Defer pending a dedicated follow-up search of akronohio.gov and/or SERB's filed-contract archive for Akron-specific dockets"
OH,SERB statewide archive (not a single city),"Not a candidate city, but a candidate source family: Ohio's State Employment Relations Board maintains a single, centralized, publicly searchable archive of filed CBAs, fact-finding reports, and conciliation awards since 2012 for every Ohio public employer -- a materially better centralized-records environment than any Massachusetts city this project has worked with",SERB contract/conciliation-award archive filterable by employer (serb.ohio.gov/view-document-archive; example conciliation award located this session for FOP:OCL and the City of Alliance),SERB archive (same portal; fire-specific conciliation awards were not individually pulled this session but the archive covers all safety-forces dockets),SERB archive also files non-safety public-employee contracts and fact-finding reports (a 2023 fact-finding report PDF was located this session, employer not yet identified in detail),Not applicable -- this is a state agency archive, not a single city's HR/budget page,"Centralized, dated, publicly searchable back to 2012 -- confirmed directly this session via multiple located PDF examples (contracts, fact-finding reports, conciliation awards)",high,"A cross-cutting backstop/verification source for any Ohio city ultimately prioritized -- useful for confirming a city's own posted CBA matches the SERB-filed version, and for locating fact-finding/conciliation history not posted on a city's own site",This is a discovery/verification tool, not a substitute for identifying a specific matched-comparison city -- should be used alongside, not instead of, a city-level acquisition plan,useful,yes,"Not a fetch-now target; flagged as a standing resource to consult once a specific Ohio city is prioritized for acquisition"
