obs_id,city_id,city_name,state,bargaining_unit_name,occupation_class,safety_flag,cycle_start,cycle_end,predecessor_obs_id,base_wage_entry,base_wage_top,pct_increase_annual,num_steps,years_to_top,longevity_pay_flag,longevity_detail,total_comp_note,interest_arbitration_flag,arbitration_clause_text,comparability_clause_flag,comparability_text,comparability_referent,me_too_clause_flag,me_too_text,no_strike_clause_flag,binding_arbitration_statute,source_type,source_corpus,source_url_or_cite,retrieval_date,retrieval_method,full_text_path,text_quality
ma_franklin_other_2022,ma_franklin,Franklin,MA,AFSCME AFL-CIO Council 93 Local 1298 Custodians,other,0,2022-07-01,2025-06-30,,,,,,,,,Official Franklin CBA portal PDF. First-page text confirms collective bargaining agreement between Town of Franklin and AFSCME Council 93 Local 1298 Custodians for July 1 2022 through June 30 2025. Classified as other because custodians are not a controlled occupation class.,0,,0,,,0,,1,MA G.L. c. 150E,cba,causal,https://www.franklinma.gov/DocumentCenter/View/440/Custodians-PDF,2026-06-25,public_download,corpus/ma_franklin/ma_franklin_custodians_2022_2025.pdf,clean
ma_wayland_police_2020,ma_wayland,Wayland,MA,"Wayland Police Officers Union, New England Police Benevolent Association",police,1,2020-07-01,2023-06-30,,,,,,,,,Official Wayland CBA portal PDF. OCR of cover page confirms collective bargaining agreement between Town of Wayland and Wayland Police Officers Union/NEPBA for July 1 2020 through June 30 2023.,0,,0,,,0,,1,MA G.L. c. 1078 (JLMC),cba,causal,https://www.wayland.ma.us/DocumentCenter/View/4561/2020-2023-Police-CBA,2026-06-25,public_download,corpus/ma_wayland/ma_wayland_police_2020_2023.pdf,ocr_messy
ma_wayland_fire_2020,ma_wayland,Wayland,MA,International Association of Firefighters AFL-CIO Local 1978,fire,1,2020-07-01,2023-06-30,,,,,,,,,Official Wayland CBA portal PDF. OCR of cover page confirms collective bargaining agreement between Town of Wayland and IAFF Local 1978 effective July 1 2020 through June 30 2023.,0,,0,"c. The Town agrees that in the event that it is be unable to provide coverage through any carrier, or if
they should choose to offer any other health insurance plan{s), the Town will contribute at least the
same percentage rate(s} for a comparable plan(s).","health insurance plan contribution parity ('comparable plan(s)') -- benefits comparability, not wage comparability",0,,0,MA G.L. c. 1078 (JLMC),cba,causal,https://www.wayland.ma.us/DocumentCenter/View/4559/2020-2023-Fire-CBA,2026-06-25,public_download,corpus/ma_wayland/ma_wayland_fire_2020_2023.pdf,ocr_messy
ma_wayland_other_2021,ma_wayland,Wayland,MA,"Local 690 Wayland-1 and Local 690 Wayland-2, AFSCME",other,0,2021-07-01,2023-06-30,,,,,,,,,"Official Wayland CBA portal PDF. OCR of cover page gives July 1 2021 through June 30 2023 despite posting section title. Recognition text covers mixed town employees including clerical, DPW, nurses, dispatch, and other positions, so classified as other.",0,,0,"b. The Town agrees that in the event that it is unable to provide coverage through any
carrier, or if they should choose to offer any other health insurance plan(s), the Town
will contribute at least the same percentage rate(s) for a comparable plan(s).","health insurance plan contribution parity ('comparable plan(s)') -- benefits comparability, not wage comparability",0,,1,MA G.L. c. 150E,cba,causal,https://www.wayland.ma.us/DocumentCenter/View/4557/2020-2023-AFSCME-1-and-2-CBA,2026-06-25,public_download,corpus/ma_wayland/ma_wayland_afscme_1_2_2020_2023.pdf,ocr_messy
ma_wayland_public_works_2020,ma_wayland,Wayland,MA,Wayland Department of Public Works employees represented by Teamsters Local 170,public_works,0,2020-07-01,2023-06-30,,,,,,,,,Official Wayland CBA portal PDF. OCR confirms agreement between Town of Wayland and Wayland DPW employees represented by Teamsters Local 170 effective July 1 2020 through June 30 2023; recognition covers DPW employees.,0,,0,,,0,,1,MA G.L. c. 150E,cba,causal,https://www.wayland.ma.us/DocumentCenter/View/4558/2020-2023-DPW-CBA,2026-06-25,public_download,corpus/ma_wayland/ma_wayland_dpw_2020_2023.pdf,ocr_messy
ma_wayland_library_2020,ma_wayland,Wayland,MA,"Wayland Library Staff Association, MFT, AFT, AFL-CIO",library,0,2020-07-01,2023-06-30,,,,,,,,,Official Wayland CBA portal PDF. OCR of cover and recognition pages confirms Town of Wayland agreement with the Wayland Library Staff Association for July 1 2020 through June 30 2023.,0,,0,,,0,,1,MA G.L. c. 150E,cba,causal,https://www.wayland.ma.us/DocumentCenter/View/4560/2020-2023-Library-CBA,2026-06-25,public_download,corpus/ma_wayland/ma_wayland_library_2020_2023.pdf,ocr_messy
ma_wayland_fire_jlmc_2020,ma_wayland,Wayland,MA,International Association of Firefighters Local 1978,fire,1,2020-07-01,2023-06-30,,,,,,,,,"Official Wayland CBA portal PDF. Text layer confirms Commonwealth of Massachusetts JLMC docket JLM-21-8988 stipulated award for Town of Wayland and IAFF Local 1978, signed April 14 2023, modifying the 2020-2023 fire agreement.",0,,0,,,0,,0,MA G.L. c. 1078 (JLMC),arbitration_award,causal,https://www.wayland.ma.us/DocumentCenter/View/4570/2020-2023-Fire---JLMC-Stipulated-Award,2026-06-25,public_download,corpus/ma_wayland/ma_wayland_fire_jlmc_stipulated_award_2020_2023.pdf,clean
tx_houston_police_2024,tx_houston,Houston,TX,Houston Police Officers' Union (HPOU),police,1,2024-07-01,2025-06-30,,,,,,,1,- A wage rate calculation that includes base pay and longevity only. Sworn Date The anniversary of employment service calculated from the date the officer - was sworn in officially as a police officer with ...,"Fetched public agreement on 2026-07-08. Identity confirmed as HPOU Meet & Confer Agreement; cycle 2024-07-01 to 2025-06-30. Caveat: Start date uses FY2025 wage schedule/negotiation-cycle cue; agreement states effective upon City Council approval and through June 30, 2025.",0,,0,,,0,,0,Texas Local Government Code Chapters 142/143,cba,causal,https://www.houstontx.gov/hr/hrfiles/classified_testing/agreement_meet_conf.pdf,2026-07-08,public_download,corpus/tx_houston/tx_houston_hpou_police_meet_confer_2024.pdf,clean
tx_houston_other_2024,tx_houston,Houston,TX,Houston Organization of Public Employees / AFSCME Local 123,other,0,2024-11-01,2027-06-30,,,,,,,1,al ........................................................................................ 33 10.03 Longevity Pay........................................................................................... 34 10.04 Bilingual Pay ............................................................................................,Fetched public agreement on 2026-07-08. Identity confirmed as HOPE / AFSCME Local 123 Meet and Confer Agreement; cycle 2024-11-01 to 2027-06-30. Recognition-clause-first review indicates broad mixed municipal coverage; occupation_class kept other. Caveat: Broad municipal unit; occupation_class kept other after recognition review.,0,,0,,,0,,1,Texas Local Government Code Chapter 146,cba,causal,https://www.houstontx.gov/hr/hrfiles/employee_relations/hope_meet_cof_agrmnt.pdf,2026-07-08,public_download,corpus/tx_houston/tx_houston_hope_afscme123_meet_confer_2024.pdf,clean
tx_austin_police_2024,tx_austin,Austin,TX,Austin Police Association,police,1,2024-10-29,2029-09-30,,,,,,,1,ly to all Officers covered by this AGREEMENT. The pay scale reflects a 4% increase to base wages. Section 2. Longevity Pay Longevity pay in the amount of one hundred and seven dollars ($107.00) per ...,Fetched public agreement on 2026-07-08. Identity confirmed as Austin Police Association Meet and Confer Agreement; cycle 2024-10-29 to 2029-09-30. Caveat: Official source page fetched first; stored file is the linked original PDF.,0,,0,,,0,,1,Texas Local Government Code Chapter 143,cba,causal,https://austin.widen.net/content/ihe4bm1ha5/original/COA-APA-Meet-and-Confer-Agreement---Fully-Executed-10.29.24.pdf?download=true,2026-07-08,public_download,corpus/tx_austin/tx_austin_apa_police_meet_confer_2024_2029.pdf,ocr_messy
oh_columbus_police_2023,oh_columbus,Columbus,OH,Fraternal Order of Police Capital City Lodge No. 9,police,1,2023-12-09,2026-12-08,,,,,,,1,nt. ......................................................................................... 87 ARTICLE 24 - LONGEVITY PAY ............................................................. 87 24.1 Payment Schedule. .......................................................................................... 87 24.2 Payment Date. ..,Fetched public agreement on 2026-07-08. Identity confirmed as Columbus FOP Lodge No. 9 CBA; cycle 2023-12-09 to 2026-12-08.,1,"Successor-contract dispute settlement references fact-finding, conciliation, or arbitration under Ohio Revised Code Chapter 4117.",0,,,0,,1,Ohio Revised Code Chapter 4117,cba,causal,https://www.columbus.gov/files/sharedassets/city/v/1/human-resources/labor-relations/fop-cba-2023-2026.pdf,2026-07-08,public_download,corpus/oh_columbus/oh_columbus_fop_lodge9_police_cba_2023_2026.pdf,clean
oh_columbus_fire_2023,oh_columbus,Columbus,OH,"Columbus Fire Fighters Union Local 67, IAFF",fire,1,2023-11-01,2026-10-31,,,,,,,0,,Fetched public agreement on 2026-07-08. Identity confirmed as Columbus IAFF Local 67 CBA; cycle 2023-11-01 to 2026-10-31.,1,Impasse procedures include selection of a conciliator from a Federal Mediation and Conciliation Service list.,0,,,0,,1,Ohio Revised Code Chapter 4117,cba,causal,https://www.columbus.gov/files/sharedassets/city/v/2/human-resources/labor-relations/iaff-cba-2023-2026.pdf,2026-07-08,public_download,corpus/oh_columbus/oh_columbus_iaff67_fire_cba_2023_2026.pdf,clean
oh_columbus_other_2024,oh_columbus,Columbus,OH,AFSCME Ohio Council 8 Local 1632,other,0,2024-04-01,2027-03-31,,,,,,,0,,Fetched public agreement on 2026-07-08. Identity confirmed as Columbus AFSCME Local 1632 CBA; cycle 2024-04-01 to 2027-03-31. Recognition-clause-first review indicates broad mixed municipal coverage; occupation_class kept other. Caveat: Broad City class-title unit; occupation_class kept other after recognition review.,0,,0,,,0,,1,Ohio Revised Code Chapter 4117,cba,causal,https://www.columbus.gov/files/sharedassets/city/v/1/human-resources/labor-relations/afscme-1632-cba-2024-2027.pdf,2026-07-08,public_download,corpus/oh_columbus/oh_columbus_afscme1632_cba_2024_2027.pdf,clean
oh_cleveland_police_2025,oh_cleveland,Cleveland,OH,Cleveland Police Patrolmen's Association (C.P.P.A.) Patrol Officer Bargaining Unit,police,1,2025-04-01,2028-03-31,,,,,,,1,................. 33 11 ARTICLE 15 LONGEVITY PAY ................................................................................................ 33 ARTICLE 16 UNIFORM ALLOWANCE ...................................................................................,Fetched public agreement on 2026-07-08. Identity confirmed as Cleveland CPPA Patrol Officers CBA; cycle 2025-04-01 to 2028-03-31.,1,Witnesseth clause references negotiations and/or interest arbitration that resulted in the contract.,0,,,0,,1,Ohio Revised Code Chapter 4117,cba,causal,https://www.clevelandohio.gov/sites/clevelandohio/files/hr/cba/2025-2028%20CPPA%20Patrol%20Officers%20CBA.pdf,2026-07-08,public_download,corpus/oh_cleveland/oh_cleveland_cppa_patrol_police_cba_2025_2028.pdf,clean
oh_cleveland_fire_2025,oh_cleveland,Cleveland,OH,"Cleveland Fire Fighters, Local 93",fire,1,2025-04-01,2028-03-31,,,,,,,1,ncarsases 45 --- OCR PAGE 4 --- TABLE OF CONTENTS Fire Station Supplies ARTICLE 19 IMPASSE ARBITRATION... Longevity Pay ACHING Pay. cccscccssssssescssessssssesecssuecsssssssnssesssssssssuscssecssssssssuessseessnessuesstvesssnucsanecestesssasesssvesseasecs 51 Jury Duty Pay... Parking Tickets ARTICLE 23 BULLETIN BOARD ARTICLE 24 COU,Fetched public agreement on 2026-07-08. Identity confirmed as Cleveland IAFF Local 93 CBA; cycle 2025-04-01 to 2028-03-31. Caveat: Image-heavy PDF; identity and selected mechanism passages confirmed through bounded local OCR.,1,ARTICLE 19 IMPASSE ARBITRATION: after sixty days either party can demand final and binding arbitration of impasse issues.,0,,,0,,1,Ohio Revised Code Chapter 4117,cba,causal,https://www.clevelandohio.gov/sites/clevelandohio/files/hr/cba/2025-2028%20Cleveland%20Firefighters%2C%20Local%2093%20CBA.pdf,2026-07-08,public_download,corpus/oh_cleveland/oh_cleveland_iaff93_fire_cba_2025_2028.pdf,ocr_messy
oh_cleveland_other_2022,oh_cleveland,Cleveland,OH,AFSCME Ohio Council 8 Local 100,other,0,2022-04-01,2025-03-31,,,,,,,1,...................... .............................................................. .....................11 Longevity ...................................................... ..........................................................................35,"Fetched public agreement on 2026-07-08. Identity confirmed as Cleveland AFSCME Local 100 CBA; cycle 2022-04-01 to 2025-03-31. Recognition-clause-first review indicates broad mixed municipal coverage; occupation_class kept other. Caveat: Broad multi-department class-title unit; occupation_class kept other after recognition review. Effective upon ratification; wage schedule begins April 1, 2022 and term runs through March 31, 2025.",0,,0,,,0,,1,Ohio Revised Code Chapter 4117,cba,causal,https://www.clevelandohio.gov/sites/clevelandohio/files/hr/cba/2022-2025%20Local%20100%2C%20AFSCME%20Ohio%20Council%208.pdf,2026-07-08,public_download,corpus/oh_cleveland/oh_cleveland_afscme_local100_cba_2022_2025.pdf,clean
tx_austin_fire_2023,tx_austin,Austin,TX,"Austin Firefighters Association, Local 975 of the International Association of Fire Fighters, AFL-CIO-CLC",fire,1,2023-09-24,2025-09-30,,,,,,,1,City pays longevity pay of $100.00 per year for each year of service up to a maximum of twenty-five (25) years of service; paid annually in a lump sum in the first regularly scheduled pay period after the Fire Fighter's anniversary date.,Education Incentive Pay / Firefighter Certification Pay (Article 9C); Bilingual Translation Pay and Staff Schedule Pay referenced as special pays with retroactive lump-sum true-up; health insurance plan referenced as an existing benefit in the drug/alcohol impairment article's cost-allocation language.,1,"If the parties reach impasse in negotiations for a successor to this Agreement and agree before this Agreement expires to submit to mediation or interest arbitration for a successor to this Agreement, then this Agreement shall be extended for a period of 90 days from expiration of this Agreement, or until final resolution of such mediation or interest arbitration, whichever occurs first.",0,,,0,,1,Texas Local Government Code Chapter 174 (Fire and Police Employee Relations Act),cba,causal,"https://www.austintexas.gov/labor-relations/fire-collective-bargaining-agreement (official page, linked original PDF: https://austin.widen.net/view/pdf/berk4a8tuc/APPENDIX-A.pdf)",2026-07-08,public_download,corpus/tx_austin/tx_austin_afa975_fire_cba_2023_2025.pdf,clean
