obs_id,city_id,city_name,state,bargaining_unit_name,occupation_class,safety_flag,cycle_start,cycle_end,predecessor_obs_id,base_wage_entry,base_wage_top,pct_increase_annual,num_steps,years_to_top,longevity_pay_flag,longevity_detail,total_comp_note,interest_arbitration_flag,arbitration_clause_text,comparability_clause_flag,comparability_text,comparability_referent,me_too_clause_flag,me_too_text,no_strike_clause_flag,binding_arbitration_statute,source_type,source_corpus,source_url_or_cite,retrieval_date,retrieval_method,full_text_path,text_quality
ma_worcester_fire_2017,ma_worcester,Worcester,MA,"Worcester Firefighters Union Local 1009, IAFF",fire,1,2017-07-01,2020-06-30,,,,0.02,,,,,"Signed successor MOA, 2017-2020 cycle. Scanned (no text layer) -> OCR at ingest. OCR-recovered wages: 2% eff. July 1 of 2017, 2018, 2019 (excludes Step 1).",0,,0,,,0,,0,,cba,causal,https://www.worcesterma.gov/human-resources/collective-bargaining-agreements/local-1009-moa-2017-2020.pdf,2026-06-16,public_download,corpus/ma_worcester/worcester_local1009_fire_cba_2017-2020.pdf,ocr_messy
ma_worcester_clerical_admin_2017,ma_worcester,Worcester,MA,"NAGE Local 490, SEIU (Worcester Clerical Association)",clerical_admin,0,2017-07-01,2020-06-30,,,,0.02,,,,,"Successor MOA (states it is pending drafting of a new contract document; incorporates prior base CBA by reference). 2% base wage increase eff. Jan 1 2018, 2019, 2020; new top step +2% above prior max eff. 2017-07-01; health deductible $250/$750 -> $500/$1,000.",0,,0,,,0,,0,,cba,causal,https://www.worcesterma.gov/human-resources/collective-bargaining-agreements/local-490-moa-2017-2020.pdf,2026-06-16,public_download,corpus/ma_worcester/worcester_local490_clerical_cba_2017-2020.pdf,clean
ma_worcester_public_works_2017,ma_worcester,Worcester,MA,Teamsters Local 170 (DPW Clerks),public_works,0,2017-07-01,2020-06-30,,,,0.02,,,,,"DPW unit (Teamsters Local 170, DPW Clerks). Successor MOA (states it is pending drafting of a new contract document; incorporates prior base CBA by reference). 2% base wage increase eff. Jan 1 2018, 2019, 2020; new top step +2% above prior max eff. 2017-07-01; health deductible $250/$750 -> $500/$1,000. MOA marked DRAFT #1 on portal.",0,,0,,,0,,0,,cba,causal,https://www.worcesterma.gov/human-resources/collective-bargaining-agreements/local-170-moa-2017-2020.pdf,2026-06-16,public_download,corpus/ma_worcester/worcester_local170_dpw_cba_2017-2020.pdf,clean
ma_boston_police_2020,ma_boston,Boston,MA,Boston Police Patrolmen Association,police,1,2020-07-01,2025-06-30,,,,,,,,,WAGE MOA ONLY — all pages are scanned photographs; OCR requires pytesseract (not installed). Manual extraction needed. Cycle dates estimated from portal title (2020-2025).,0,,0,,,0,,0,MA G.L. c. 1078 (JLMC),cba,causal,https://www.boston.gov/sites/default/files/file/2023/12/BPPA%20MOA%202020-2025.pdf,2026-06-17,public_download,corpus/ma_boston/ma_boston_police_bppa_moa_2020_2025.pdf,partial
ma_boston_clerical_admin_2023,ma_boston,Boston,MA,United Steelworkers AFL-CIO CLC on behalf of Salaried Employees of North America Local 9158,clerical_admin,0,2023-10-01,2027-09-30,,,,,,,,,Full base CBA. City-wide administrative/clerical unit; merged units include SENA 9158E (Public Facilities/DND) and 9158F (BCYF). Has no-strike and binding arbitration clauses.,0,"A. INTRODUCTION
         The City of Boston and the Union recognize that Chapter I SOE, Section 8 of the
General Laws provides a mechanism for arbitration of disputes between the parties to a
collective bargaining agreement and further provides that the parties to an agreement may
establish an independent grievance procedure culminating in final and binding arbitration.
It is the intent of the parties to this agreement to use their best efforts to encourage the
informal and prompt settlement of grievances which may arise between the Union or a
member or members of the bargaining unit and the City. Therefore the parties agree, for
themselves and for all those whom they represent, that they shall use the procedures set
forth in this Article, and no other procedures, for the resolution, strictly pursuant to the
terms of this Agreement, of all disputes involving the application of this Agreement and of
any other matter that is or may become the subject of a grievance as hereinafter defined.
B. DEFINITION
         1. Grievance Form - a grievance form is a written statement, which shall be
expressly denominated ""Grievance Form"", setting forth a grievance as hereinafter
defined. A grievance form shall cover all the known facts material to the alleged breach
on which the grievance is based, including the date when such breach is alleged to have
occurred and the specific contractual provisions alleged to have been breached, and shall
set forth the remedy requested.
        2. Grievant- grievant shall mean the union or any member or members of the
bargaining unit, as the case may be, who pursuant to the terms of this Agreement, seek
resolution of a grievance.
        3. Grievance - a grievance of an allegation by the Union or by a member or
members of the bargaining unit that an express provision of the Agreement has been
breached in its application to it, him, or them, respectively. Any incident which occurred
or failed to occur prior to the effective date of this Agreement shall not be the subject of
any grievance hereunder.
        4. Day - for the purposes of this Article, day shall mean a working day.
C. PROCEDURES FOR FILING A GRIEVANCE
        The Union or any member of members of the bargaining unit having a grievance,
as defined above, shall seek its resolution only in accordance with the grievance procedure
set forth in this Article.",0,,,0,,1,MA G.L. c. 150E,cba,causal,https://www.boston.gov/sites/default/files/file/2025/12/SENA%2C%20Local%209158%20CBA%202023-2027.pdf,2026-06-17,public_download,corpus/ma_boston/ma_boston_clerical_sena9158_cba_2023_2027.pdf,clean
ma_somerville_police_spsoa_2012,ma_somerville,Somerville,MA,Somerville Police Superior Officers Association,police,1,2012-07-01,2018-06-30,,,,0.0225,,,,Document is base CBA (1997-2000) + amendments through 2018. Terminal 6-year award (June 2018; neutral Gary D. Altman): FY13=2.5%; FY14-16=2%; FY17-18=2.5%. Retrieved from MuckRock public FOIA release. Integrated with JLMC arbitration decision.,MA G.L. c. 1078 (JLMC),1,"1
Analysis and Issues
    Under the Collective Bargaining Laws of Massachusetts,
the Interest Arbitration process is utilized when ""there is
an exhaustion of the process of collective bargaining which
constitutes a potential threat to public welfare"". In
reaching the conclusions in the present award, the
Arbitration Panel has considered the criteria set forth in
the statute including the municipality's ability to pay,
wages and benefits of comparable towns, and the cost of
living. It must also be noted that large gains or major
concessions are not achieved in the format of arbitration.
An arbitrator is reluctant to modify contract provisions
where the parties, in past years, have already reached
agreement, the contract article has been in the contract
for a considerable period of time, and there has been no
ascertainable problem with the contract language.
Background
    The City of Somerville is located in Middlesex County.
It has a population of approximately 80,000 people in a
land area of 4.2 square miles. The City is governed by a
Mayor and has an eleven member Board of Aldermen. The
bargaining unit is composed of thirty-one (31) Superior
Officers, comprised of four Captains, eleven Lieutenants,
and sixteen Sergeants.
    The parties initially engaged in direct negotiations
for an agreement covering the period from July 1, 2012
through June 30, 2015. They were, however, unable to reach
agreement for this three-year period of time. In the
meantime, Interest Arbitration proceedings were completed
for the Somerville Police Association and the City,
covering the period of July 1, 2012 through June 30, 2015.
The Superior Officers and the City have agreed that the",1,"In
reaching the conclusions in the present award, the
Arbitration Panel has considered the criteria set forth in
the statute including the municipality's ability to pay,
wages and benefits of comparable towns, and the cost of
living.",comparable towns (statutory interest-arbitration criterion: wages and benefits of comparable towns),0,,1,MA G.L. c. 1078 (JLMC),arbitration_award,causal,https://cdn.muckrock.com/foia_files/2020/08/27/SPSOA_1997_-_2018_reduced.pdf,2026-06-17,public_download,corpus/ma_somerville/ma_somerville_police_spsoa_cba_1997_2018.pdf,clean
ma_somerville_police_spea_2012,ma_somerville,Somerville,MA,Somerville Police Employees Association,police,1,2012-07-01,2015-06-30,,,,0.022,,,,Document is base CBA (2004-2008) + amendments through 2015. Terminal award (December 22 2016; neutral Gary D. Altman): FY13=2.5%; FY14=2%; FY15=2%. Retrieved from MuckRock public FOIA release. Full mechanism clauses present.,MA G.L. c. 1078 (JLMC),1,"1
Analysis and Issues
    Under the Collective Bargaining Laws of Massachusetts,
the Interest Arbitration process is utilized when ""there is
an exhaustion of the process of collective bargaining which
constitutes a potential threat to public welfare"". In
reaching the conclusions in the present award, the
Arbitration Panel has considered the criteria set forth in
the statute including the municipality's ability to pay,
wages and benefits of comparable towns, and the cost of
living. It must also be noted that large gains or major
concessions are not achieved in the format of arbitration.
An arbitrator is reluctant to modify contract provisions
where the parties, in past years, have already reached
agreement, the contract article has been in the contract
for a considerable period of time, and there has been no
ascertainable problem with the contract language.
Background
    The City of Somerville is located in Middlesex County.
It has a population of approximately 80,000 people in a
land area of 4.2 square miles. The City is governed by a
Mayor and has an eleven member Board of Aldermen. The
bargaining unit is composed of approximately eighty-eight
patrol officers. The most recent Collective Bargaining
Agreement expired on June 30, 2012.
    The JLMC conducted a Section 3A hearing on November
12, 2015. At the outset of the hearing each party submitted
a list of outstanding issues to the JLMC. On November 23,
2015 the Committee determined that there was “an apparent
exhaustion of the process of collective bargaining which
constitutes a potential threat to public welfare.” The JLMC
certified the following issues to be decided in the
arbitration proceeding:",1,"In
reaching the conclusions in the present award, the
Arbitration Panel has considered the criteria set forth in
the statute including the municipality's ability to pay,
wages and benefits of comparable towns, and the cost of
living.",comparable towns (statutory interest-arbitration criterion: wages and benefits of comparable towns),0,,1,MA G.L. c. 1078 (JLMC),arbitration_award,causal,https://cdn.muckrock.com/foia_files/2020/08/27/SPEA_CBA_July_1_2004_-_June_30_2015.pdf,2026-06-17,public_download,corpus/ma_somerville/ma_somerville_police_spea_cba_2004_2015.pdf,clean
ma_arlington_fire_2021,ma_arlington,Arlington,MA,"International Association of Firefighters, AFL-CIO, Local 1297",fire,1,2021-07-01,2024-06-30,,56074,67331,0.0465,7,,1,Longevity payment percentage of base salary per Appendix A; details require OCR verification,"Full base CBA (44 pp, IA OCR). IAFF Local 1297 covers firefighters lieutenants captains deputy chiefs. Night tour differential 5.4% of base. EMT stipend 5% FY2022 / 5.5% FY2023. Three annual salary tables embedded; FY2023 increase ~4.84% FY2024 ~4.46% (Step 7 comparison). Wages and longevity detail require manual verification due to OCR artifacts.",0,,0,,,0,,0,MA G.L. c. 1078 (JLMC),cba,causal,https://archive.org/download/Arlington_MA_ShowDocument_Id_62647/Fire%20Contract%20FY20222024_text.pdf,2026-06-17,public_download,corpus/ma_arlington/ma_arlington_fire_iaff_cba_fy2022_2024.pdf,ocr_messy
ma_arlington_public_works_2015,ma_arlington,Arlington,MA,"American Federation of State County and Municipal Employees, Council 93, Local 680",public_works,0,2015-07-01,2018-06-30,,,,0.02,,,1,Longevity schedule in Appendix A,"Full base CBA (30 pp, clean text). Covers Labor Service (DPW, custodians), clerical, civil engineers grades 1-3, and administrative personnel (excludes police/fire/school committee). FY2016: 2%; FY2017: 2%; FY2018: 2%. Comparability clause present. No-strike and grievance/arbitration clauses present.",0,"A grievance involving the suspension, dismissal, removal or termination of an employee under
civil service law and rules may in any instance be subject to binding arbitration by mutual
agreement of the parties and the election of the employee involved, in accordance with the
provision of Section 8 of Chapter 1078 of the acts of 1973. In any such proceeding either under
civil service law and rules or under the grievance and arbitration procedure, the union reserves",0,"If an employee has been out of work as a result of a work related injury and the Town’s workers’
compensation/line of duty office is advised by the employee’s physician or the Town’s
examining physician or comparable medical provider that the employee is presently unable to
perform the essential duties of their job and that their return to work is not imminent, then:",workers' compensation / line-of-duty medical-provider comparability (non-wage),0,,1,MA G.L. c. 150E,cba,causal,https://archive.org/download/Arlington_MA_ShowDocument_Id_35623/AFSCMEContractFY20162018.pdf,2026-06-17,public_download,corpus/ma_arlington/ma_arlington_afscme_cba_fy2016_2018.pdf,clean
ma_arlington_public_works_2018,ma_arlington,Arlington,MA,"American Federation of State County and Municipal Employees, Council 93, Local 680",public_works,0,2018-07-01,2021-06-30,,,,0.0167,,,1,Longevity schedule in Appendix A,"Full base CBA (31 pp, clean text). FY2019: 2% + $0.35 market adj to top step (Jan 2019). FY2020: 2% + $0.20 market adj to top step (Jan 2020). FY2021: 1%. Average annual increase 1.67%. Comparability clause present. Predecessor contract: AFSCME FY2016-2018.",0,"A grievance involving the suspension, dismissal, removal or termination of an employee under
civil service law and rules may in any instance be subject to binding arbitration by mutual
agreement of the parties and the election of the employee involved, in accordance with the
provision of Section 8 of Chapter 1078 of the acts of 1973. In any such proceeding either under
civil service law and rules or under the grievance and arbitration procedure, the union reserves
the right to represent employees covered by this agreement. However, disciplinary matters are
not subject to the grievance procedure under this article until and employee has been employed
for six (6) months.",0,"If an employee has been out of work as a result of a work related injury and the Town’s workers’
compensation/line of duty office is advised by the employee’s physician or the Town’s
examining physician or comparable medical provider that the employee is presently unable to
perform the essential duties of their job and that their return to work is not imminent, then:",workers' compensation / line-of-duty medical-provider comparability (non-wage),0,,1,MA G.L. c. 150E,cba,causal,https://archive.org/download/Arlington_MA_ShowDocument_Id_47592/AFSCMEContractFY20182021.pdf,2026-06-17,public_download,corpus/ma_arlington/ma_arlington_afscme_cba_fy2018_2021.pdf,clean
ma_arlington_public_works_2021,ma_arlington,Arlington,MA,"American Federation of State County and Municipal Employees, Council 93, Local 680",public_works,0,2021-07-01,2024-06-30,,,,,,,1,,Full base CBA (35 pp) but scanned with poor OCR (4485 text chars from 35 pages). Cycle Jul 2021-Jun 2024 matches Arlington Fire FY2022-2024 exactly. Wage rates and mechanism clause text require OCR or manual extraction for GABRIEL fields.,0,,0,,,0,,1,MA G.L. c. 150E,cba,causal,https://archive.org/download/Arlington_MA_ShowDocument_Id_62981/AFSCME%20Contract%20Expires%20Ju.pdf,2026-06-17,public_download,corpus/ma_arlington/ma_arlington_afscme_cba_thru_june2024.pdf,ocr_messy
ma_newton_police_2015,ma_newton,Newton,MA,Newton Police Association (union name unconfirmed — document scanned no text layer),police,1,2015-07-01,2018-06-30,,,,,,,,,CYCLE DATES ESTIMATED. Scanned PDF 74 pages 43MB ~0 extractable text chars. File created March 2018 suggests this is the then-current contract (likely 2015-2018 or 2016-2019 cycle). All fields including union name and cycle dates require OCR (pytesseract not installed). Source: LRIS public contract database.,0,,0,,,0,,0,MA G.L. c. 1078 (JLMC),cba,causal,https://www.lris.com/wp-content/uploads/contracts/newton_ma_police.pdf,2026-06-17,public_download,corpus/ma_newton/ma_newton_police_cba_lris.pdf,partial
ma_georgetown_police_2020,ma_georgetown,Georgetown,MA,"American Federation of State, County and Municipal Employees, AFL-CIO Council 93, Local 939 (Police Command Staff)",police,1,2020-07-01,2023-06-30,,,,0.02,,,1,Longevity for Police Department employees with 15+ years; see Article 18.,"StateReference DLR Contracts item. Original image-only PDF and StateReference OCR PDF downloaded locally; OCR text confirms Town of Georgetown police command staff unit (Lieutenant, Sergeant, Detective Sergeant), full municipal contract, 2020-2023 cycle, and 2% COLA effective July 1 of 2020, 2021, and 2022. DLR original route: Public Information Search employer Georgetown, Town of.",0,,0,,,0,,1,MA G.L. c. 1078 (JLMC),cba,causal,https://www.statereference.com/items/dlr_contracts/20210818_ascme_local_939_police_command_staff_7_1_20_to_6_30_23_georgetown_town_of,2026-06-23,public_download,corpus/ma_georgetown/ma_georgetown_police_command_staff_2020_2023_ocr.pdf,clean
ma_georgetown_other_2020,ma_georgetown,Georgetown,MA,"American Federation of State, County and Municipal Employees, AFL-CIO, Mass. Public Council 93, Local 939 (Custodians)",other,0,2020-07-01,2023-06-30,,,,0.02,,,,,"StateReference DLR Contracts item. Original image-only PDF and StateReference OCR PDF downloaded locally; OCR text confirms Georgetown School Department custodians/matrons/maintenance unit, full CBA, 2020-2023 cycle, and Appendix A wage schedule with 2% steps for 7/1/2020, 7/1/2021, and 7/1/2022. DLR original route: Public Information Search employer Georgetown School Committee.",0,,0,,,0,,1,MA G.L. c. 150E,cba,causal,https://www.statereference.com/items/dlr_contracts/20200716_afscme_local_939_custodians_7_1_20_to_6_30_23_georgetown_school_committee,2026-06-23,public_download,corpus/ma_georgetown/ma_georgetown_afscme_custodians_2020_2023_ocr.pdf,clean
ma_seekonk_police_2022,ma_seekonk,Seekonk,MA,The Fraternal Order of Police Mass C.O.P. Local # 215,police,1,2022-07-01,2025-06-30,,,,,,,,,Official Seekonk archive PDF. First-page text confirms collective bargaining agreement between Town of Seekonk and FOP Mass C.O.P. Local #215 for July 1 2022 through June 30 2025.,0,,0,,,0,,0,MA G.L. c. 1078 (JLMC),cba,causal,https://www.seekonk-ma.gov/Archive.aspx?ADID=282,2026-06-24,public_download,corpus/ma_seekonk/ma_seekonk_police_mcop_local_215_2022_2025.pdf,clean
ma_seekonk_fire_2022,ma_seekonk,Seekonk,MA,International Association of Firefighters Local 1931,fire,1,2022-07-01,2025-06-30,,,,,,,,,Official Seekonk archive PDF. First-page text confirms contract between Town of Seekonk Massachusetts and International Association of Firefighters Local 1931 for July 1 2022 through June 30 2025.,0,,0,"An annual group re-alignment shall be offered once a year between September 1st and November 1st.
Employees shall be able to submit a bid, and be awarded based on availability and seniority, a work slot on
another group. Group re-alignments will be posted by December 1st and take effect on January 1st. Any re-
alignment of employees shall occur upon the agreement of the affected employees, and upon the condition
that the emergency medical certifications are identical and their years of employment with the department
are somewhat comparable. Re-alignments will be granted and become effective at the Fire Chief’s discretion.","work-group realignment eligibility ('years of employment... somewhat comparable') -- scheduling/seniority context, not wage comparability",0,,0,MA G.L. c. 1078 (JLMC),cba,causal,https://www.seekonk-ma.gov/Archive.aspx?ADID=641,2026-06-24,public_download,corpus/ma_seekonk/ma_seekonk_fire_iaff_local_1931_2022_2025.pdf,clean
ma_seekonk_clerical_admin_2021,ma_seekonk,Seekonk,MA,"Local 1701, State Council No. 93, American Federation of State, County and Municipal Employees, AFL-CIO (Administrative Secretaries)",clerical_admin,0,2021-07-01,2024-06-30,,,,,,,,,Official Seekonk school-contract archive PDF. Local OCR confirms agreement between Seekonk School Committee and AFSCME Local 1701 administrative secretaries for July 1 2021 through June 30 2024.,0,,0,,,0,,1,MA G.L. c. 150E,cba,causal,https://www.seekonk-ma.gov/Archive.aspx?ADID=261,2026-06-24,public_download,corpus/ma_seekonk/ma_seekonk_admin_secretaries_afscme_local_1701_2021_2024.pdf,ocr_messy
ma_seekonk_teacher_2021,ma_seekonk,Seekonk,MA,Seekonk Educators Association,teacher,0,2021-09-01,2024-08-31,,,,,,,,,Official Seekonk school-contract archive PDF. First-page text confirms agreement between School Committee of the Town of Seekonk and Seekonk Educators Association for September 1 2021 through August 31 2024.,0,,0,,,0,,1,MA G.L. c. 150E,cba,causal,https://www.seekonk-ma.gov/Archive.aspx?ADID=260,2026-06-24,public_download,corpus/ma_seekonk/ma_seekonk_educators_association_2021_2024.pdf,clean
ma_seekonk_public_works_2023,ma_seekonk,Seekonk,MA,AFSCME Council 93 Local 1701 Department of Public Works,public_works,0,2023-07-01,2026-06-30,,,,,,,,,Official Seekonk archive PDF. First-page text confirms collective bargaining agreement between Town of Seekonk and AFSCME Council 93 Local 1701 Department of Public Works for July 1 2023 through June 30 2026.,0,Final binding arbitration will prevail on grievances only.,0,,,0,,0,MA G.L. c. 150E,cba,causal,https://www.seekonk-ma.gov/Archive.aspx?ADID=727,2026-06-24,public_download,corpus/ma_seekonk/ma_seekonk_public_works_afscme_local_1701_2023_2026.pdf,clean
ma_seekonk_library_2023,ma_seekonk,Seekonk,MA,"Seekonk Public Library Employee Association MLSA, AFT Massachusetts, AFL-CIO Local 4928",library,0,2023-07-01,2026-06-30,,,,,,,,,Official Seekonk archive PDF. First-page text confirms collective bargaining agreement between Town of Seekonk and Seekonk Public Library Employee Association MLSA/AFT Massachusetts Local 4928 for July 1 2023 through June 30 2026.,0,,0,,,0,,0,MA G.L. c. 150E,cba,causal,https://www.seekonk-ma.gov/Archive.aspx?ADID=711,2026-06-24,public_download,corpus/ma_seekonk/ma_seekonk_library_mlsa_local_4928_2023_2026.pdf,clean
ma_franklin_fire_2022,ma_franklin,Franklin,MA,"Professional Firefighters of Franklin, International Association of Firefighters Local 2637",fire,1,2022-07-01,2025-06-30,,,,,,,,,Official Franklin CBA portal PDF. First-page text confirms collective bargaining agreement between Town of Franklin and Professional Firefighters of Franklin IAFF Local 2637 for July 1 2022 through June 30 2025.,0,,0,,,0,,1,MA G.L. c. 1078 (JLMC),cba,causal,https://www.franklinma.gov/DocumentCenter/View/443/Firefighters-PDF,2026-06-25,public_download,corpus/ma_franklin/ma_franklin_firefighters_2022_2025.pdf,clean
ma_franklin_police_2022,ma_franklin,Franklin,MA,The Franklin Police Association,police,1,2022-07-01,2025-06-30,,,,,,,,,Official Franklin CBA portal PDF. First-page text confirms collective bargaining agreement between Town of Franklin and the Franklin Police Association for July 1 2022 through June 30 2025.,0,,0,,,0,,0,MA G.L. c. 1078 (JLMC),cba,causal,https://www.franklinma.gov/DocumentCenter/View/444/Police-Association-PDF,2026-06-25,public_download,corpus/ma_franklin/ma_franklin_police_association_2022_2025.pdf,clean
ma_franklin_police_sergeants_2022,ma_franklin,Franklin,MA,The Franklin Police Sergeants Union,police,1,2022-07-01,2025-06-30,,,,,,,,,Official Franklin CBA portal PDF. First-page text confirms collective bargaining agreement between Town of Franklin and the Franklin Police Sergeants Union for July 1 2022 through June 30 2025. Distinct police bargaining unit from the police association.,0,,0,,,0,,0,MA G.L. c. 1078 (JLMC),cba,causal,https://www.franklinma.gov/DocumentCenter/View/445/Police-Sergeants-PDF,2026-06-25,public_download,corpus/ma_franklin/ma_franklin_police_sergeants_2022_2025.pdf,clean
ma_franklin_public_works_2022,ma_franklin,Franklin,MA,AFSCME AFL-CIO Local 1298 Department of Public Works,public_works,0,2022-07-01,2025-06-30,,,,,,,,,Official Franklin CBA portal PDF. First-page text confirms collective bargaining agreement between Town of Franklin and AFSCME AFL-CIO Local 1298 Department of Public Works for July 1 2022 through June 30 2025.,0,,0,,,0,,1,MA G.L. c. 150E,cba,causal,https://www.franklinma.gov/DocumentCenter/View/441/Department-of-Public-Works-PDF,2026-06-25,public_download,corpus/ma_franklin/ma_franklin_public_works_2022_2025.pdf,clean
ma_franklin_library_2022,ma_franklin,Franklin,MA,"Franklin Public Library Staff Association, Massachusetts Library Staff Association Local 4928, AFT Massachusetts",library,0,2022-07-01,2025-06-30,,,,,,,,,Official Franklin CBA portal PDF. First-page text confirms agreement between Town of Franklin and Franklin Public Library Staff Association/MLSA Local 4928 for July 1 2022 through June 30 2025.,0,,0,,,0,,0,MA G.L. c. 150E,cba,causal,https://www.franklinma.gov/DocumentCenter/View/442/Franklin-Public-Library-PDF,2026-06-25,public_download,corpus/ma_franklin/ma_franklin_library_2022_2025.pdf,clean
