resolution_status,state,city,source_role,source_target,resolved_url_or_lookup_path,source_family,proposed_use,proposed_corpus,safe_to_fetch,safe_to_ingest_as_causal,official_or_high_quality_source,reason,caveat,next_action,notes
resolved_exact,TX,Austin,non_safety_general,"Agreement between the City of Austin and Austin EMS Association (AEMSA) -- Meet and Confer Agreement, 2023-2027",https://www.austintexas.gov/labor-relations/ems-meet-and-confer-agreement -> https://austin.widen.net/view/pdf/7eikyuh3qq/2023-EMS-TA-Contract---FINAL-9.14.23---Executed.pdf,meet_and_confer_agreement,causal_evidence,causal,yes,yes,yes,"Downloaded and text-extracted (88 pages, 250,194 chars, clean text layer via ingest/extract_text.py). Confirms a genuine, complete meet-and-confer agreement (Article 1 Preamble through Article 26, plus wage-schedule appendices) between the City of Austin and the Austin EMS Association, on the same official austintexas.gov/labor-relations page family and austin.widen.net hosting pattern already used for the ingested Austin police and fire agreements. Article 3 Recognition: 'The CITY recognizes the ASSOCIATION as the sole and exclusive bargaining agent for all Uniformed Staff.' Article 2 Definitions confirms 'Uniformed Staff' applies only to employees 'Employed in the Department as ""Emergency Medical Services Personnel"" as defined by Texas Health and Safety Code, Chapter 773' and 'Whose position requires substantial knowledge of ""Emergency Prehospital Care""' -- explicitly excluding civilian employees. Article 6 sets a real 4-year fiscal-year base wage schedule (FY23-24 baseline; FY24-25 +4.0%; FY25-26 +3.0%; FY26-27 +3.0%) plus education incentive pay. Article 23 confirms the term runs from ratification or October 1, 2023 (whichever is later) through September 30, 2027.","Austin-Travis County EMS is a separate department from the Austin Fire Department, governed by its own Chapter 142 Subchapter D meet-and-confer statute and a joint Firefighters'/Police Officers'/EMS Civil Service Commission under Chapter 143 -- i.e., EMS is civil-service-protected and statutorily adjacent to police/fire, but is NOT itself 'police' or 'fire' under this project's controlled occupation_class vocabulary. Classified as occupation_class=nurse_health (closest schema fit for pre-hospital emergency medical personnel), safety_flag=0, consistent with this project's existing practice of coding safety-adjacent occupations (dispatchers, nurses) as legitimate non-safety comparison units. This is a single-occupation bargaining unit (EMS personnel only, civilians explicitly excluded) -- no recognition-clause-first bundling ambiguity applies.",fetch_and_ingest,"Resolves the Austin non-safety held-out target that a prior session left open after confirming AFSCME Local 1624's document was a consultation policy, not a wage-setting agreement. A July 18, 2024 amendment to this agreement also exists at the same official page; reviewed for context but not fetched as a separate document, since the base 2023-2027 agreement is a complete, self-sufficient text."
resolved_context_only,TX,Austin,source_discovery,City Council item File #26-1362 (vacation-leave-accrual boilerplate referencing 'non-sworn employees not covered by collective bargaining or meet and confer agreements'),https://services.austintexas.gov/edims/document.cfm?id=470611,city_page,source_discovery,not_applicable,no,no,yes,"Downloaded and read in full (2,328 chars, clean text layer); an unrelated City Clerk compensation item that only generically distinguishes 'non-sworn employees not covered by collective bargaining or meet and confer agreements' from those who are (i.e., police/fire/EMS) -- it does not identify a separate civilian non-safety bargaining agreement and is not itself a wage-setting source.",A dead-end lead that nonetheless helped confirm no additional non-safety bargaining channel exists beyond EMS.,reject,Read for verification only; not stored in corpus/.
resolved_context_only,TX,Austin,source_discovery,AFSCME Local 1624 consultation agreement (already resolved in the prior session as non-causal),https://www.austintexas.gov/council/2026/20260122-reg,consultation_policy,institutional_context,context_only,no,no,yes,"Re-confirmed unchanged from the prior session's finding (texas_ohio_heldout_source_resolution_2026-07-08.csv): City Council Resolution No. 20260122-049 is a consultation-policy resolution, not a wage-setting CBA.",Not re-fetched this session; carried forward for completeness.,reject,"Superseded in practical effect by the EMS meet-and-confer agreement resolved above, which does supply Austin's non-safety comparison partner."
deferred,TX,Fort Worth,non_safety_general,Fort Worth non-safety municipal wage-setting source (backup city evaluation),not_applicable,source_discovery,source_discovery,unknown,no,no,unclear,"Not evaluated this session -- Austin was successfully resolved as Texas's second matched city (see the EMS row above), so the backup-city evaluation (Task C) was not triggered per this run's decision rule.",Prior planning (texas_ohio_multicity_source_targets_2026-07-08.csv) found no confirmed non-safety institutional channel for Fort Worth ('Pay for Performance Program for non-civil-service employees instead').,defer,Available for a future third-Texas-city expansion if ever prioritized.
deferred,TX,San Antonio,non_safety_general,San Antonio non-safety municipal wage-setting source (backup city evaluation),not_applicable,source_discovery,source_discovery,unknown,no,no,unclear,"Not evaluated this session -- Austin was successfully resolved as Texas's second matched city, so the backup-city evaluation (Task C) was not triggered.",Prior planning found no non-safety institutional channel identified for San Antonio.,defer,Available for a future third-Texas-city expansion if ever prioritized.
